title,text,url,date,source,companies,clean_title,clean_text,clean_combined,sentiment
Big deal eau-énergie : l’État impulse et le privé propulse,"Le 19 mai 2025, le Maroc et ses partenaires émiratis ont signé trois protocoles d’accord de près de 150 milliards de dirhams. Ce partenariat a pour objectif d’assurer la production, d’ici 2030, de 900 millions de m³ d’eau dessalée par an, le transport de 800 millions de m³ via une «autoroute de l’eau» et l’intégration de 1.200 MW d’énergie propre, couplés à une ligne électrique à haute tension (HVDC) de 3.000 MW entre Dakhla et Casablanca.

Ce projet d‘envergure sera réalisé via un partenariat publicprivé (PPP) inédit. Plus qu’un outil financier, ce modèle apparaît aujourd’hui comme la clé d’un développement durable et accéléré, à même de répondre aux défis climatiques et hydriques du Royaume.

Le Maroc s’appuie sur la loi n°86-12 relative aux contrats de PPP, qui établit un cadre rigoureux fondé sur la transparence, la gouvernance responsable, le suivi et la répartition équitable des risques. Cette loi permet à l’État de garantir des services publics aux standards internationaux, tout en valorisant l’expertise, la capacité financière et la réactivité du secteur privé. En optant pour ce modèle, ce partenariat garantit un apport de capitaux, un partage des risques, un transfert de compétences et une rapidité de mise en œuvre.

Qui fait quoi ?

Porté par le gouvernement marocain, l’Office national de l’électricité et de l’eau potable (ONEE) et les géants privés Taqa Morocco et Nareva, en consortium avec le Fonds Mohammed VI pour l’investissement (FM6I), ce méga-programme réinvente la manière de concevoir les infrastructures. Tandis que l’État garantit les concessions foncières et la structuration réglementaire, l’ONEE sécurise les garanties d’achat d’énergie et d’eau, le FM6I, avec une participation de 15%, joue le rôle de caution souveraine.

Les partenaires privés, Taqa et Nareva (chacun 42,5%), assurent les études techniques, les avantprojets et les levées de fonds d’emprunt. Cette répartition permet de mutualiser les risques, d’optimiser les délais et d’attirer des capitaux internationaux. Là où un montage purement public aurait pris des années de procédures, le PPP permet ici un gain estimé de 24 mois dans la mise en service, prévue dès 2028.

Rappelons que ce n’est pas une première pour le Maroc. Le pays capitalise sur ses précédentes réussites en PPP, à l’image de la centrale thermique de Safi, mise en service en 2017, grâce à une co-entreprise entre Nareva, Engie et Mitsui, avec l’ONEE comme maître d’ouvrage. Un exemple cité en référence pour son efficacité, son transfert de compétences et la mobilisation de 9 milliards de dirhams d’investissements privés. Le projet de relance de la centrale à gaz de Tahaddart (400 MW) s’inscrit dans cette continuité. Développée initialement avec Endesa et Siemens, la centrale sera désormais pilotée par le trio Taqa-Nareva-FM6I, avec un investissement estimé à 1 milliard de dollars pour augmenter les capacités à cycle combiné à 1.100 MW.

Un levier de souveraineté hydrique et énergétique

Pour Abdelmajid Iraqui Houssaini, président du Directoire de Taqa Morocco «ce partenariat stratégique public-privé contribue à transformer durablement le paysage énergétique et hydrique national. Il permet l’accroissement des capacités de dessalement afin de soutenir la feuille de route climatique et renforcer la souveraineté hydrique et énergétique du Royaume». Un discours partagé par Reda Hamedoun, vice-président exécutif de Nareva Holding, qui a affirmé, lors d’un panel au Global Growth Conference tenu récemment à Rabat, que «ce n’est pas simplement un programme d’infrastructures au travers duquel l’on ajoute des capacités de génération d’électricité renouvelable ou bas carbone. Mais c’est aussi un grand programme de cohésion sociale, de développement territorial et de transfert de technologies». Pour la réussite de ce projet, Nareva mise sur son expérience en matière d’innovation technologique.

«Nous avons été les premiers en Afrique à développer la technologie ultra-supercritique avec la centrale de Safi. Et nous exploitons aujourd’hui le plus grand parc éolien du continent à Aftissat (400 MW)», a conclu son responsable. Au-delà des chiffres, ce PPP est un catalyseur de développement local. Plus de 25.000 emplois devraient être créés, dont 10.000 durables. Bureaux d’études marocains, PME de maintenance et centres de formation seront impliqués. Une dynamique industrielle est attendue autour du dessalement, de l’hydraulique solaireair, et du transport d’électricité. Ce schéma pourrait devenir la matrice des futurs grands chantiers du Royaume : stockage d’énergie à Ouarzazate, extensions à Agadir ou Dakhla, infrastructures de transport vertes… L’État donne l’impulsion, le privé accélère l’action. Ensemble, ils construisent les fondations d’un Maroc souverain, résilient et décarboné.",https://fnh.ma/article/developpement-durable/big-deal-eau-energie,2025-06-17 11:09:33.338874,Finance News,Taqa Morocco,big deal eau e nergie l e tat impulse prive propulse,19 mai 2025 maroc ses partenaires e miratis signe trois protocoles d accord pre s 150 milliards dirhams partenariat objectif d assurer production d 2030 900 millions m3 d eau dessale e an transport 800 millions m3 via autoroute l eau l inte gration 1 200 mw d e nergie propre couple s ligne e lectrique haute tension hvdc 3 000 mw entre dakhla casablanca projet d envergure re alise via partenariat publicprive ppp ine dit plus qu outil financier mode apparai t aujourd hui comme cle d veloppement durable acce re re pondre fis climatiques hydriques royaume maroc s appuie loi n 86 12 relative contrats ppp e tablit cadre rigoureux fonde transparence gouvernance responsable suivi re partition e quitable risques loi permet l e tat garantir services publics standards internationaux tout valorisant l expertise capacite financie re re activite secteur prive optant mode partenariat garantit apport capitaux partage risques transfert compe tences rapidite mise œuvre fait quoi porte gouvernement marocain l office national l e lectricite l eau potable onee ge ants prive s taqa morocco nareva consortium fonds mohammed vi l fm6i ga programme re invente manie re concevoir infrastructures tandis l e tat garantit concessions foncie res structuration re glementaire l onee curise garanties d achat d e nergie d eau fm6i participation 15 joue ro caution souveraine partenaires prive s taqa nareva chacun 42 5 assurent e tudes techniques avantprojets leve fonds d emprunt re partition permet mutualiser risques d optimiser lais d attirer capitaux internationaux montage purement public pris anne proce dures ppp permet gain estime 24 mois mise service pre vue s 2028 rappelons n premie re maroc pays capitalise ses pre dentes re ussites ppp l image centrale thermique safi mise service 2017 gra co entre nareva engie mitsui l onee comme mai tre d ouvrage exemple cite re fe rence efficacite transfert compe tences mobilisation 9 milliards dirhams d investissements prive s projet relance centrale gaz tahaddart 400 mw s inscrit continuite veloppe e initialement endesa siemens centrale sormais pilote e trio taqa nareva fm6i estime 1 dollars augmenter capacite s cycle combine 1 100 mw levier souverainete hydrique e nerge tique abdelmajid iraqui houssaini pre sident directoire taqa morocco partenariat strate gique public prive contribue transformer durablement paysage e nerge tique hydrique national permet l accroissement capacite s dessalement afin soutenir feuille route climatique renforcer souverainete hydrique e nerge tique royaume discours partage reda hamedoun vice pre sident exe cutif nareva holding affirme lors d panel global growth conference tenu re cemment rabat n simplement programme d infrastructures travers duquel l ajoute capacite s ge ne ration d e lectricite renouvelable bas carbone c aussi grand programme cohe sion sociale veloppement territorial transfert technologies re ussite projet nareva mise expe rience matie re d innovation technologique e premiers afrique velopper technologie ultra supercritique centrale safi exploitons aujourd hui plus grand parc e olien continent aftissat 400 mw conclu responsable dela chiffres ppp catalyseur veloppement local plus 25 000 emplois devraient e tre cre e s dont 10 000 durables bureaux d e tudes marocains pme maintenance centres formation implique s dynamique industrielle attendue autour dessalement l hydraulique solaireair transport d e lectricite sche pourrait devenir matrice futurs grands chantiers royaume stockage d e nergie ouarzazate extensions agadir dakhla infrastructures transport vertes l e tat donne l impulsion prive acce re l action ensemble construisent fondations d maroc souverain re silient carbone,big deal eau e nergie l e tat impulse prive propulse 19 mai 2025 maroc ses partenaires e miratis signe trois protocoles d accord pre s 150 milliards dirhams partenariat objectif d assurer production d 2030 900 millions m3 d eau dessale e an transport 800 millions m3 via autoroute l eau l inte gration 1 200 mw d e nergie propre couple s ligne e lectrique haute tension hvdc 3 000 mw entre dakhla casablanca projet d envergure re alise via partenariat publicprive ppp ine dit plus qu outil financier mode apparai t aujourd hui comme cle d veloppement durable acce re re pondre fis climatiques hydriques royaume maroc s appuie loi n 86 12 relative contrats ppp e tablit cadre rigoureux fonde transparence gouvernance responsable suivi re partition e quitable risques loi permet l e tat garantir services publics standards internationaux tout valorisant l expertise capacite financie re re activite secteur prive optant mode partenariat garantit apport capitaux partage risques transfert compe tences rapidite mise œuvre fait quoi porte gouvernement marocain l office national l e lectricite l eau potable onee ge ants prive s taqa morocco nareva consortium fonds mohammed vi l fm6i ga programme re invente manie re concevoir infrastructures tandis l e tat garantit concessions foncie res structuration re glementaire l onee curise garanties d achat d e nergie d eau fm6i participation 15 joue ro caution souveraine partenaires prive s taqa nareva chacun 42 5 assurent e tudes techniques avantprojets leve fonds d emprunt re partition permet mutualiser risques d optimiser lais d attirer capitaux internationaux montage purement public pris anne proce dures ppp permet gain estime 24 mois mise service pre vue s 2028 rappelons n premie re maroc pays capitalise ses pre dentes re ussites ppp l image centrale thermique safi mise service 2017 gra co entre nareva engie mitsui l onee comme mai tre d ouvrage exemple cite re fe rence efficacite transfert compe tences mobilisation 9 milliards dirhams d investissements prive s projet relance centrale gaz tahaddart 400 mw s inscrit continuite veloppe e initialement endesa siemens centrale sormais pilote e trio taqa nareva fm6i estime 1 dollars augmenter capacite s cycle combine 1 100 mw levier souverainete hydrique e nerge tique abdelmajid iraqui houssaini pre sident directoire taqa morocco partenariat strate gique public prive contribue transformer durablement paysage e nerge tique hydrique national permet l accroissement capacite s dessalement afin soutenir feuille route climatique renforcer souverainete hydrique e nerge tique royaume discours partage reda hamedoun vice pre sident exe cutif nareva holding affirme lors d panel global growth conference tenu re cemment rabat n simplement programme d infrastructures travers duquel l ajoute capacite s ge ne ration d e lectricite renouvelable bas carbone c aussi grand programme cohe sion sociale veloppement territorial transfert technologies re ussite projet nareva mise expe rience matie re d innovation technologique e premiers afrique velopper technologie ultra supercritique centrale safi exploitons aujourd hui plus grand parc e olien continent aftissat 400 mw conclu responsable dela chiffres ppp catalyseur veloppement local plus 25 000 emplois devraient e tre cre e s dont 10 000 durables bureaux d e tudes marocains pme maintenance centres formation implique s dynamique industrielle attendue autour dessalement l hydraulique solaireair transport d e lectricite sche pourrait devenir matrice futurs grands chantiers royaume stockage d e nergie ouarzazate extensions agadir dakhla infrastructures transport vertes l e tat donne l impulsion prive acce re l action ensemble construisent fondations d maroc souverain re silient carbone,neutral
