title,text,url,date,source,companies,clean_title,clean_text,clean_combined,sentiment
"Attijariwafa Bank : L'AMMC vise le prospectus relatif à l'émission d'un emprunt obligataire subordonné de 1,5 milliard de dirhams","D'une maturité de 7 ans, cet emprunt se compose de deux tranches non cotées, indique l'AMMC dans un communiqué, précisant que la période de souscription s'étale du 23 au 25 juin 2025 inclus.



Le taux d'intérêt facial de la tranche ""A"" est fixe. Il est déterminé en référence à la courbe des taux de référence du marché secondaire des bons du Trésor de maturité 7 ans telle qu’elle sera publiée par Bank Al-Maghrib en date du 20 juin 2025, augmenté d’une prime de risque de 50 points de base (pbs).



Concernant la tranche ""B"", son taux d'intérêt facial est révisable annuellement. Pour la première année, ce taux est le taux plein 52 semaines (taux monétaire) déterminé en référence à la courbe des taux de référence du marché secondaire des bons du Trésor telle qu’elle sera publiée par Bank Al-Maghrib vendredi, augmenté d’une prime de risque de 45 pbs.





",https://www.boursenews.ma/article/alaune/ATW-AMMC-vise-le-prospectus-relatif-a-l-emission-d-un-emprunt-obligataire,2025-06-17 11:11:40.262979,Boursenews,Attijariwafa Bank,attijariwafa bank ammc vise prospectus relatif e mission emprunt obligataire subordonne 1 5 dirhams,maturite 7 ans emprunt compose deux tranches non cote indique ammc communique pre cisant pe riode souscription e tale 23 25 juin 2025 inclus inte re t facial tranche fixe termine re fe rence courbe re fe rence marche secondaire bons tre sor maturite 7 ans telle qu publie e bank al maghrib date 20 juin 2025 augmente d prime risque 50 points base pbs concernant tranche b inte re t facial re visable premie re anne e plein 52 semaines mone taire termine re fe rence courbe re fe rence marche secondaire bons tre sor telle qu publie e bank al maghrib vendredi augmente d prime risque 45 pbs,attijariwafa bank ammc vise prospectus relatif e mission emprunt obligataire subordonne 1 5 dirhams maturite 7 ans emprunt compose deux tranches non cote indique ammc communique pre cisant pe riode souscription e tale 23 25 juin 2025 inclus inte re t facial tranche fixe termine re fe rence courbe re fe rence marche secondaire bons tre sor maturite 7 ans telle qu publie e bank al maghrib date 20 juin 2025 augmente d prime risque 50 points base pbs concernant tranche b inte re t facial re visable premie re anne e plein 52 semaines mone taire termine re fe rence courbe re fe rence marche secondaire bons tre sor telle qu publie e bank al maghrib vendredi augmente d prime risque 45 pbs,neutral
Sociétés cotées : Le guide Boursenews 2025 des Assemblées générales,"Boursenews présente son guide des Assemblées générales, contenant résolutions et actualité des assemblées générales des émetteurs.

La saison des résultats annuels 2024 n'est pas encore terminée. Les sociétés faisant appel public à l’épargne, notamment celles cotées à la Bourse de Casablanca, ont jusqu’au 30 avril pour publier leurs rapports financiers annuels. Cette période coïncide également avec la préparation des Assemblées générales ordinaires (AGO). Les entreprises doivent faire preuve d’anticipation en publiant leurs avis de convocation au moins 30 jours avant la date de leurs AG.

En tant qu’actionnaire, vous détenez une part de chaque entreprise dans laquelle vous investissez. Mais saviez-vous que vous pouvez également jouer un rôle actif dans sa gouvernance ? L’Assemblée générale est le moment clé pour vous informer, vous exprimer, et voter sur les décisions stratégiques. C’est aussi une opportunité unique d’échanger avec les dirigeants et de mieux comprendre vos investissements.

Ce guide vous aide à comprendre et tirer pleinement parti de ce droit. Il est mis à jour régulièrement et accessible à tout moment depuis notre feuille de marché.

Qu’est-ce qu’une Assemblée Générale ?

L’Assemblée générale (AG) est une réunion des actionnaires. C’est un moment de décision, de transparence et de débat, encadré par la loi 17-95 sur les sociétés anonymes et par les statuts de chaque société.

Il existe trois types d’assemblées :

AGO (Assemblée Générale Ordinaire) : tenue au moins une fois par an pour statuer sur la gestion courante (approbation des comptes, dividendes, nomination des administrateurs…).

AGE (Assemblée Générale Extraordinaire) : convoquée pour décider de modifications importantes des statuts.

AG Mixte : combine à la fois des résolutions ordinaires et extraordinaires.

Pourquoi y participer ?

En tant qu'actionnaire, vous disposez de trois droits fondamentaux à exercer lors d’une AG :

1. Droit à l’information

Accéder à l’ordre du jour, aux rapports de gestion et à la liste des actionnaires.

Se préparer de manière éclairée aux discussions et aux votes.

2. Droit d’expression

Proposer l’ajout de résolutions à l’ordre du jour si vous atteignez un certain seuil de détention.

Prendre la parole pendant la réunion.

3. Droit de décision

Voter sur les comptes, les nominations, les dividendes ou d’autres résolutions importantes.

Influencer l’orientation stratégique de l’entreprise.

Avant l’Assemblée : bien se préparer

La convocation

Elle doit être publiée au moins 30 jours avant la tenue de l’AG dans un journal d’annonces légales et sur le site web de l’entreprise.

Elle précise : la date, l’heure, le lieu, l’ordre du jour, et les modalités de participation.

Vérifiez vos droits de participation

Vous pouvez participer, quel que soit le nombre d’actions que vous possédez.

Si les statuts exigent un seuil (10 actions maximum), vous pouvez vous regrouper avec d'autres actionnaires pour être représenté.

Vous devrez peut-être inscrire vos actions au nominatif ou présenter un certificat de détention si vous détenez des actions au porteur.

Le jour J : comment se déroule l’AG ?

Enregistrement : les présences sont vérifiées.

Ouverture : l’AG commence si le quorum est atteint (au moins 25 % des actions avec droit de vote).

Débats et votes : les résolutions sont présentées, discutées, puis soumises au vote.

Bureau de l’AG : composé d’un président, de deux scrutateurs et d’un secrétaire.

Votes : chaque action donne droit à une voix. Les scrutateurs vérifient et comptabilisent les résultats.

Après l’AG : où trouver les résultats ?

Un procès-verbal officiel est rédigé et archivé au siège social. Il contient :

- Les décisions adoptées.

- Le détail des votes : pour, contre, abstentions.

Il est consultable par tout actionnaire.

Les sociétés cotées doivent également publier les résultats des votes sur leur site internet.

BONUS : Tous les avis de convocation en un seul endroit :

Société Date de l'AGO Dividende proposé Date de détachement Date de paiement Lieu et détails des résolutions AFMA 11/06/2025 60 Visualiser Afric industrie 06/05/2025 22 10/06/2025 19/06/2025 Visualiser Afriquia gaz 12/03/2025 175 25/03/2024 08/04/2025 Visualiser Agma 30/05/2025 300 24/07/2025 Visualiser Akdital 18/06/2025 10 31/07/2025 Visualiser Alliances 09/05/2025 3,6 21/07/2025 Visualiser Aluminium du maroc 24/06/2025 100 Visualiser Aradei Capital 13/05/2025 22 11/06/2025 20/06/2025 Visualiser Atlanta Sanad 21/05/2025 5,8 10/06/2025 19/06/2025 Visualiser Attijariwafa Bank 30/04/2025 19 27/05/2025 05/06/2025 Visualiser Auto hall 27/05/2025 2 10/06/2025 18/06/2025 Visualiser Auto nejma 15/04/2025 120 22/05/2025 02/06/2025 Visualiser Balima 23/06/2025 5,50 Visualiser BOA 24/06/2025 5 21/07/2025 Visualiser BCP 30/06/2025 10,5 Visualiser BMCI 20/05/2025 18 16/06/2025 25/06/2025 Visualiser CFG bank 29/05/2025 3,3 13/06/2025 24/06/2025 Visualiser Ciments du Maroc 26/05/2025 60 18/07/2025 29/07/2025 Visualiser CMGP 20/06/2025 6,3 01/09/2025 Visualiser Colorado 15/05/2025 2,6 12/06/2025 23/06/2025 Visualiser CTM 17/06/2025 N.S Visualiser CMT 26/06/2025 0 Visualiser Cosumar 18/06/2025 10 31/07/2025 Visualiser CDM 17/06/2026 41,7 10/07/2025 Visualiser CIH 11/06/2025 14 30/06/2025 09/07/2025 Visualiser Dari Couspate 25/06/2025 140 29/07/2025 Visualiser Delta holding 13/05/2025 2,25 10/07/2025 21/07/2025 Visualiser Disty 05/06/2025 16,5 Visualiser Disway 15/05/2025 40 30/06/2025 09/07/2025 Visualiser Douja Prom Addoha 24/06/2025 0,5 30/09/2025 Visualiser Ennakl 25/04/2025 2,38 27/05/2025 05/06/2025 Visualiser Eqdom 30/05/2025 0 Visualiser Fenie brossette 24/06/2025 0 Visualiser HPS 26/06/2025 7 25/07/2025 Visualiser Immorente Invest 26/03/2025 1 (T1) 18/04/2025 29/042025 Visualiser 2,2 (T2) 17/06/2025 26/06/2025 Visualiser 2 (S2) Visualiser Involys 26/06/2025 0 Visualiser IAM 27/03/2025 1,43 02/06/2025 Visualiser Jet Contractors 29/05/2025 15 Visualiser Label vie 26/06/2025 110,57 Visualiser LafargeHolcim Maroc 21/05/2025 70 13/06/2025 24/06/2025 Visualiser Lesieur 20/05/2025 3 30/06/2025 09/07/2025 Visualiser M2M 19/06/2025 0 Visualiser Maghreb oxygene 12/03/2025 4 25/03/2025 08/04/2025 Visualiser Maghrebail 14/05/2025 53 27/08/2025 08/09/2025 Visualiser Managem 11/06/2025 40 01/07/2025 Visualiser Maroc leasing 23/05/2025 14 26/09/2025 Visualiser Med paper 25/06/2025 0 Visualiser Microdata 24/06/2025 40 25/07/2025 Visualiser Mutandis 08/04/2025 10,5 30/06/2025 09/07/2025 Visualiser Rebab company 23/06/2025 0 Visualiser RDS 20/06/2025 0 Visualiser Risma 30/06/2025 7 Au plus tard le 30/09/2025 Visualiser Salafin 22/05/2025 29,5 06/06/2025 17/06/2025 Visualiser Sanlam Maroc 28/05/2025 81 01/07/2025 Visualiser Sodep Marsa Maroc 25/06/2025 9,5 28/07/2025 Visualiser Promopharm 20/06/2025 0 Visualiser SRM 30/06/2025 0 Visualiser Sothema 21/05/2025 28 20/06/2025 02/07/2025 Visualiser SBM 14/05/2025 100 10/06/2025 19/06/2025 Visualiser Oulmes 13/05/2025 23 18/06/2025 30/06/2025 Visualiser S2M 20/06/2025 0 Visualiser SMI 11/06/2025 80 01/07/2025 Visualiser SNEP 24/06/2025 0 Visualiser Sonasid 19/06/2025 39 Au plus tard le 31/07/2025 Visualiser Stokvis nord afrique 05/06/2025 0 Visualiser Stroc industrie 19/06/2025 0 Visualiser Taqa Morocco 23/05/2025 37 Au plus tard le 26/09/2025 Visualiser Total energies Maroc 11/06/2025 113 19/06/2025 30/06/2025 Visualiser TGCC 21/05/2025 11,5 15/07/2025 Visualiser Unimer 13/05/2025 0 Visualiser Wafa assurance 20/05/2025 140 17/06/2025 26/06/2025 Visualiser Zellidja 23/06/2025 0 Visualiser

*N.S : Non signalé(e)

Ressources : Guide de l'AMMC sur les Assemblées générales",https://www.boursenews.ma/article/decryptage/societes-cotees-guide-assemblees-generales-maroc,2025-06-17 11:11:45.895055,Boursenews,"Attijariwafa Bank,Maroc Telecom,Bank of Africa,Cosumar,Lafarge Holcim Maroc,Label Vie,Marsa Maroc,Taqa Morocco,Sonasid,Managem",socie s cote guide boursenews 2025 assemble ge ne rales,boursenews pre sente guide assemble ge ne rales contenant re solutions actualite assemble ge ne rales e metteurs saison re sultats annuels 2024 ne encore termine e socie s faisant appel public l e pargne notamment celles cote casablanca jusqu 30 avril publier rapports financiers annuels pe riode coi ncide e galement pre paration assemble ge ne rales ordinaires ago entreprises doivent faire preuve d anticipation publiant avis convocation moins 30 jours avant date ag tant qu tenez part chaque laquelle investissez saviez pouvez e galement jouer ro actif gouvernance l assemble e ge ne rale moment cle informer exprimer voter cisions strate giques c aussi opportunite unique d e changer dirigeants mieux comprendre vos investissements guide aide comprendre tirer pleinement parti droit mis jour re gulie rement accessible tout moment depuis feuille marche qu qu assemble e ge ne rale l assemble e ge ne rale ag re union c moment cision transparence bat encadre loi 17 95 socie s anonymes statuts chaque socie existe trois types d assemble ago assemble e ge ne rale ordinaire tenue moins fois an statuer gestion courante approbation comptes nomination administrateurs age assemble e ge ne rale extraordinaire convoque e cider modifications importantes statuts ag mixte combine fois re solutions ordinaires extraordinaires pourquoi participer tant disposez trois droits fondamentaux exercer lors d ag 1 droit l information acce der l ordre jour rapports gestion liste pre parer manie re e claire e discussions votes 2 droit d expression proposer l ajout re solutions l ordre jour atteignez certain seuil tention prendre parole pendant re union 3 droit cision voter comptes nominations d autres re solutions importantes influencer l orientation strate gique l avant l assemble e bien pre parer convocation doit e tre publie e moins 30 jours avant tenue l ag journal d annonces gales site web l pre cise date l heure lieu l ordre jour modalite s participation ve rifiez vos droits participation pouvez participer nombre d posse dez statuts exigent seuil 10 maximum pouvez regrouper autres e tre repre sente devrez peut e tre inscrire vos nominatif pre senter certificat tention tenez porteur jour j comment roule l ag enregistrement pre sences ve rifie l ag commence quorum atteint moins 25 droit vote bats votes re solutions pre sente discute puis soumises vote bureau l ag compose d pre sident deux scrutateurs d secre taire votes chaque action donne droit voix scrutateurs ve rifient comptabilisent re sultats apre s l ag trouver re sultats proce s verbal officiel re dige archive sie ge social contient cisions adopte tail votes contre abstentions consultable tout socie s cote doivent e galement publier re sultats votes site internet bonus tous avis convocation seul endroit socie date ago dividende propose date tachement date paiement lieu tails re solutions afma 11 06 2025 60 visualiser afric industrie 06 05 2025 22 10 06 2025 19 06 2025 visualiser afriquia gaz 12 03 2025 175 25 03 2024 08 04 2025 visualiser agma 30 05 2025 300 24 07 2025 visualiser akdital 18 06 2025 10 31 07 2025 visualiser alliances 09 05 2025 3 6 21 07 2025 visualiser aluminium maroc 24 06 2025 100 visualiser aradei 13 05 2025 22 11 06 2025 20 06 2025 visualiser atlanta sanad 21 05 2025 5 8 10 06 2025 19 06 2025 visualiser attijariwafa bank 30 04 2025 19 27 05 2025 05 06 2025 visualiser auto hall 27 05 2025 2 10 06 2025 18 06 2025 visualiser auto nejma 15 04 2025 120 22 05 2025 02 06 2025 visualiser balima 23 06 2025 5 50 visualiser boa 24 06 2025 5 21 07 2025 visualiser bcp 30 06 2025 10 5 visualiser bmci 20 05 2025 18 16 06 2025 25 06 2025 visualiser cfg bank 29 05 2025 3 3 13 06 2025 24 06 2025 visualiser ciments maroc 26 05 2025 60 18 07 2025 29 07 2025 visualiser cmgp 20 06 2025 6 3 01 09 2025 visualiser colorado 15 05 2025 2 6 12 06 2025 23 06 2025 visualiser ctm 17 06 2025 n s visualiser cmt 26 06 2025 0 visualiser cosumar 18 06 2025 10 31 07 2025 visualiser cdm 17 06 2026 41 7 10 07 2025 visualiser cih 11 06 2025 14 30 06 2025 09 07 2025 visualiser dari couspate 25 06 2025 140 29 07 2025 visualiser delta holding 13 05 2025 2 25 10 07 2025 21 07 2025 visualiser disty 05 06 2025 16 5 visualiser disway 15 05 2025 40 30 06 2025 09 07 2025 visualiser douja prom addoha 24 06 2025 0 5 30 09 2025 visualiser ennakl 25 04 2025 2 38 27 05 2025 05 06 2025 visualiser eqdom 30 05 2025 0 visualiser fenie brossette 24 06 2025 0 visualiser hps 26 06 2025 7 25 07 2025 visualiser immorente invest 26 03 2025 1 t1 18 04 2025 29 042025 visualiser 2 2 t2 17 06 2025 26 06 2025 visualiser 2 s2 visualiser involys 26 06 2025 0 visualiser iam 27 03 2025 1 43 02 06 2025 visualiser jet contractors 29 05 2025 15 visualiser label vie 26 06 2025 110 57 visualiser lafargeholcim maroc 21 05 2025 70 13 06 2025 24 06 2025 visualiser lesieur 20 05 2025 3 30 06 2025 09 07 2025 visualiser m2m 19 06 2025 0 visualiser maghreb oxygene 12 03 2025 4 25 03 2025 08 04 2025 visualiser maghrebail 14 05 2025 53 27 08 2025 08 09 2025 visualiser managem 11 06 2025 40 01 07 2025 visualiser maroc leasing 23 05 2025 14 26 09 2025 visualiser med paper 25 06 2025 0 visualiser microdata 24 06 2025 40 25 07 2025 visualiser mutandis 08 04 2025 10 5 30 06 2025 09 07 2025 visualiser rebab company 23 06 2025 0 visualiser rds 20 06 2025 0 visualiser risma 30 06 2025 7 plus tard 30 09 2025 visualiser salafin 22 05 2025 29 5 06 06 2025 17 06 2025 visualiser sanlam maroc 28 05 2025 81 01 07 2025 visualiser sodep marsa maroc 25 06 2025 9 5 28 07 2025 visualiser promopharm 20 06 2025 0 visualiser srm 30 06 2025 0 visualiser sothema 21 05 2025 28 20 06 2025 02 07 2025 visualiser sbm 14 05 2025 100 10 06 2025 19 06 2025 visualiser oulmes 13 05 2025 23 18 06 2025 30 06 2025 visualiser s2m 20 06 2025 0 visualiser smi 11 06 2025 80 01 07 2025 visualiser snep 24 06 2025 0 visualiser sonasid 19 06 2025 39 plus tard 31 07 2025 visualiser stokvis nord afrique 05 06 2025 0 visualiser stroc industrie 19 06 2025 0 visualiser taqa morocco 23 05 2025 37 plus tard 26 09 2025 visualiser total energies maroc 11 06 2025 113 19 06 2025 30 06 2025 visualiser tgcc 21 05 2025 11 5 15 07 2025 visualiser unimer 13 05 2025 0 visualiser wafa assurance 20 05 2025 140 17 06 2025 26 06 2025 visualiser zellidja 23 06 2025 0 visualiser n s non signale e ressources guide ammc assemble ge ne rales,socie s cote guide boursenews 2025 assemble ge ne rales boursenews pre sente guide assemble ge ne rales contenant re solutions actualite assemble ge ne rales e metteurs saison re sultats annuels 2024 ne encore termine e socie s faisant appel public l e pargne notamment celles cote casablanca jusqu 30 avril publier rapports financiers annuels pe riode coi ncide e galement pre paration assemble ge ne rales ordinaires ago entreprises doivent faire preuve d anticipation publiant avis convocation moins 30 jours avant date ag tant qu tenez part chaque laquelle investissez saviez pouvez e galement jouer ro actif gouvernance l assemble e ge ne rale moment cle informer exprimer voter cisions strate giques c aussi opportunite unique d e changer dirigeants mieux comprendre vos investissements guide aide comprendre tirer pleinement parti droit mis jour re gulie rement accessible tout moment depuis feuille marche qu qu assemble e ge ne rale l assemble e ge ne rale ag re union c moment cision transparence bat encadre loi 17 95 socie s anonymes statuts chaque socie existe trois types d assemble ago assemble e ge ne rale ordinaire tenue moins fois an statuer gestion courante approbation comptes nomination administrateurs age assemble e ge ne rale extraordinaire convoque e cider modifications importantes statuts ag mixte combine fois re solutions ordinaires extraordinaires pourquoi participer tant disposez trois droits fondamentaux exercer lors d ag 1 droit l information acce der l ordre jour rapports gestion liste pre parer manie re e claire e discussions votes 2 droit d expression proposer l ajout re solutions l ordre jour atteignez certain seuil tention prendre parole pendant re union 3 droit cision voter comptes nominations d autres re solutions importantes influencer l orientation strate gique l avant l assemble e bien pre parer convocation doit e tre publie e moins 30 jours avant tenue l ag journal d annonces gales site web l pre cise date l heure lieu l ordre jour modalite s participation ve rifiez vos droits participation pouvez participer nombre d posse dez statuts exigent seuil 10 maximum pouvez regrouper autres e tre repre sente devrez peut e tre inscrire vos nominatif pre senter certificat tention tenez porteur jour j comment roule l ag enregistrement pre sences ve rifie l ag commence quorum atteint moins 25 droit vote bats votes re solutions pre sente discute puis soumises vote bureau l ag compose d pre sident deux scrutateurs d secre taire votes chaque action donne droit voix scrutateurs ve rifient comptabilisent re sultats apre s l ag trouver re sultats proce s verbal officiel re dige archive sie ge social contient cisions adopte tail votes contre abstentions consultable tout socie s cote doivent e galement publier re sultats votes site internet bonus tous avis convocation seul endroit socie date ago dividende propose date tachement date paiement lieu tails re solutions afma 11 06 2025 60 visualiser afric industrie 06 05 2025 22 10 06 2025 19 06 2025 visualiser afriquia gaz 12 03 2025 175 25 03 2024 08 04 2025 visualiser agma 30 05 2025 300 24 07 2025 visualiser akdital 18 06 2025 10 31 07 2025 visualiser alliances 09 05 2025 3 6 21 07 2025 visualiser aluminium maroc 24 06 2025 100 visualiser aradei 13 05 2025 22 11 06 2025 20 06 2025 visualiser atlanta sanad 21 05 2025 5 8 10 06 2025 19 06 2025 visualiser attijariwafa bank 30 04 2025 19 27 05 2025 05 06 2025 visualiser auto hall 27 05 2025 2 10 06 2025 18 06 2025 visualiser auto nejma 15 04 2025 120 22 05 2025 02 06 2025 visualiser balima 23 06 2025 5 50 visualiser boa 24 06 2025 5 21 07 2025 visualiser bcp 30 06 2025 10 5 visualiser bmci 20 05 2025 18 16 06 2025 25 06 2025 visualiser cfg bank 29 05 2025 3 3 13 06 2025 24 06 2025 visualiser ciments maroc 26 05 2025 60 18 07 2025 29 07 2025 visualiser cmgp 20 06 2025 6 3 01 09 2025 visualiser colorado 15 05 2025 2 6 12 06 2025 23 06 2025 visualiser ctm 17 06 2025 n s visualiser cmt 26 06 2025 0 visualiser cosumar 18 06 2025 10 31 07 2025 visualiser cdm 17 06 2026 41 7 10 07 2025 visualiser cih 11 06 2025 14 30 06 2025 09 07 2025 visualiser dari couspate 25 06 2025 140 29 07 2025 visualiser delta holding 13 05 2025 2 25 10 07 2025 21 07 2025 visualiser disty 05 06 2025 16 5 visualiser disway 15 05 2025 40 30 06 2025 09 07 2025 visualiser douja prom addoha 24 06 2025 0 5 30 09 2025 visualiser ennakl 25 04 2025 2 38 27 05 2025 05 06 2025 visualiser eqdom 30 05 2025 0 visualiser fenie brossette 24 06 2025 0 visualiser hps 26 06 2025 7 25 07 2025 visualiser immorente invest 26 03 2025 1 t1 18 04 2025 29 042025 visualiser 2 2 t2 17 06 2025 26 06 2025 visualiser 2 s2 visualiser involys 26 06 2025 0 visualiser iam 27 03 2025 1 43 02 06 2025 visualiser jet contractors 29 05 2025 15 visualiser label vie 26 06 2025 110 57 visualiser lafargeholcim maroc 21 05 2025 70 13 06 2025 24 06 2025 visualiser lesieur 20 05 2025 3 30 06 2025 09 07 2025 visualiser m2m 19 06 2025 0 visualiser maghreb oxygene 12 03 2025 4 25 03 2025 08 04 2025 visualiser maghrebail 14 05 2025 53 27 08 2025 08 09 2025 visualiser managem 11 06 2025 40 01 07 2025 visualiser maroc leasing 23 05 2025 14 26 09 2025 visualiser med paper 25 06 2025 0 visualiser microdata 24 06 2025 40 25 07 2025 visualiser mutandis 08 04 2025 10 5 30 06 2025 09 07 2025 visualiser rebab company 23 06 2025 0 visualiser rds 20 06 2025 0 visualiser risma 30 06 2025 7 plus tard 30 09 2025 visualiser salafin 22 05 2025 29 5 06 06 2025 17 06 2025 visualiser sanlam maroc 28 05 2025 81 01 07 2025 visualiser sodep marsa maroc 25 06 2025 9 5 28 07 2025 visualiser promopharm 20 06 2025 0 visualiser srm 30 06 2025 0 visualiser sothema 21 05 2025 28 20 06 2025 02 07 2025 visualiser sbm 14 05 2025 100 10 06 2025 19 06 2025 visualiser oulmes 13 05 2025 23 18 06 2025 30 06 2025 visualiser s2m 20 06 2025 0 visualiser smi 11 06 2025 80 01 07 2025 visualiser snep 24 06 2025 0 visualiser sonasid 19 06 2025 39 plus tard 31 07 2025 visualiser stokvis nord afrique 05 06 2025 0 visualiser stroc industrie 19 06 2025 0 visualiser taqa morocco 23 05 2025 37 plus tard 26 09 2025 visualiser total energies maroc 11 06 2025 113 19 06 2025 30 06 2025 visualiser tgcc 21 05 2025 11 5 15 07 2025 visualiser unimer 13 05 2025 0 visualiser wafa assurance 20 05 2025 140 17 06 2025 26 06 2025 visualiser zellidja 23 06 2025 0 visualiser n s non signale e ressources guide ammc assemble ge ne rales,negative
