title,text,url,date,source,companies,clean_title,clean_text,clean_combined,sentiment
Transition énergétique : pourquoi le Maroc mise sur l’hydrogène vert,"Le marché mondial de l'hydrogène représente actuellement 100 millions de tonnes. Il est en mutation en raison des contraintes de décarbonation, poussant les grands consommateurs (off-takers) à rechercher des sources d'hydrogène bas carbone. A fin 2024, environ 75 milliards de dollars de projets d'hydrogène ont été décidés et sont en construction ou en opération, car ils ont des clients engagés.

De plus, 200 à 300 milliards de dollars de projets sont en phase d'étude pour les 3 ou 4 prochaines années. Dans ce contexte, le Maroc n’avance plus à pas mesurés sur l’hydrogène vert : il accélère. En validant en mars 2025 six projets industriels majeurs dans les régions de Laâyoune, Guelmim et Dakhla pour un montant total de 319 milliards de dirhams (près de 30 milliards d’euros), le Royaume envoie un signal fort. Il veut s’imposer comme un acteur central sur le marché mondial de l’hydrogène vert et aspire ainsi à couvrir plus de 4% de la demande d’ici 2030. Ces projets, portés par des consortiums de géants internationaux, notamment allemands, américains, saoudiens, chinois, émiratis et marocains, visent à produire de l’hydrogène, de l’ammoniac, de l’acier vert ou encore des carburants propres pour le transport maritime.

Le groupe ORNX, par exemple, regroupe les entreprises Ortus (USA), Acciona (Espagne) et Nordex (Allemagne), et ciblera la production d’ammoniac vert. D’autres comme Taqa, CEPSA, Nareva, ou encore le chinois China Three Gorges ont également été retenus, illustrant l’intérêt international croissant pour le potentiel marocain. Le Maroc peut compter sur un avantage structurel majeur : ses ressources renouvelables sont quasi illimitées. Grâce à des taux d’ensoleillement record et des régimes de vents puissants dans les provinces du Sud, le pays peut produire de l’hydrogène vert à des coûts parmi les plus bas au monde, proches de 2 dollars/kg, selon l’Institut de recherche en énergie solaire et énergies nouvelles (IRESEN).

Ce prix représente un seuil crucial pour que l’hydrogène devienne compétitif face aux énergies fossiles. À l’échelle mondiale, l’hydrogène n’est plus réservé aux véhicules à pile, dont l'essor est aujourd'hui largement dépassé par les batteries. Il devient la clé pour décarboner des pans entiers de l'industrie lourde (acier, engrais, ciment), mais aussi pour remplacer le gaz et le charbon dans les centrales électriques. Et c’est là que le Maroc entend jouer un rôle stratégique.

L’hydrogène, levier de souveraineté

Cette course n’est pas une mode, c’est une bataille géoéconomique qui se joue à grande échelle. Des pays comme l’Allemagne, lourdement dépendants du gaz russe, ont fait un revirement depuis la guerre en Ukraine. Berlin prévoit désormais d’importer 70% de son hydrogène, et cherche activement des partenaires fiables. Le Maroc s’inscrit clairement dans cette stratégie européenne, et une déclaration d’intention bilatérale germano-marocaine a été signée en juin 2024 pour soutenir les investissements et les interconnexions. Annalena Baerbock, ministre des Affaires étrangères allemande, avait affirmé à cette occasion que «le Maroc est déjà un phare dans cette transition dans la région».

De plus, le projet de pipeline H2Med, qui reliera le Portugal, l’Espagne et la France, prévoit aussi une extension vers le Maroc, ce qui offrirait au Royaume une porte d’entrée directe vers les marchés industriels européens. À terme, cette infrastructure permettrait d’exporter l’hydrogène marocain, ou l’ammoniac, son dérivé plus facilement transportable, jusqu’aux usines allemandes ou françaises. Et c’est justement l’ammoniac qui pourrait transformer le modèle économique du Maroc. Produit à partir d’hydrogène, ce dérivé est déjà utilisé à grande échelle dans les engrais, un secteur stratégique pour le pays, où le groupe OCP est le cinquième exportateur mondial.

Cependant, une problématique se pose selon laquelle le Maroc importe encore l’ammoniac au prix fort : 2 milliards de dollars par an, principalement auprès de la Russie et des États-Unis. Une situation paradoxale pour un pays qui possède les plus grandes réserves mondiales de phosphate. En développant sa propre production d’ammoniac vert, le Royaume pourrait boucler sa chaîne de valeur des engrais: énergie renouvelable, hydrogène, ammoniac et phosphate. Résultat : un renforcement de sa souveraineté industrielle, une montée en gamme de ses exportations et une compétitivité accrue sur un marché mondial estimé à plus de 200 milliards de dollars, au même niveau que celui de l’or.

Le Maroc ne joue pas simplement la carte de l’hydrogène pour répondre à des engagements climatiques. Il s’agit d’un choix économique et stratégique majeur, qui redessine les contours de sa politique industrielle, énergétique et diplomatique. À travers l’hydrogène vert et ses dérivés, le Royaume peut non seulement prétendre à un rôle de fournisseur stratégique pour l’Europe, mais aussi à une restructuration profonde de son tissu industriel. Une ambition crédible, à condition de réussir l’exécution, la gouvernance des projets et l’industrialisation rapide des filières. Mais une chose est sûre : la fenêtre d’opportunité est là et le Maroc entend bien ne pas la laisser passer.",https://fnh.ma/article/developpement-durable/transition-energetique-maroc-hydrogene-vert,2025-06-17 11:10:23.011471,Finance News,Taqa Morocco,transition e nerge tique pourquoi maroc mise l hydroge ne vert,marche mondial hydroge ne repre sente actuellement 100 millions tonnes mutation raison contraintes carbonation poussant grands consommateurs off takers rechercher sources hydroge ne bas carbone fin 2024 environ 75 milliards dollars projets hydroge ne e cide s construction ope ration car clients engage s plus 200 300 milliards dollars projets phase e tude 3 4 prochaines anne contexte maroc n avance plus mesure s l hydroge ne vert acce re validant mars 2025 six projets industriels majeurs re gions laa youne guelmim dakhla montant total 319 milliards dirhams pre s 30 milliards d royaume envoie signal fort veut s imposer comme acteur central marche mondial l hydroge ne vert aspire ainsi couvrir plus 4 demande d 2030 projets porte s consortiums ge ants internationaux notamment allemands ame ricains saoudiens chinois e miratis marocains visent produire l hydroge ne l ammoniac l acier vert encore carburants propres transport maritime ornx exemple regroupe entreprises ortus usa acciona espagne nordex allemagne ciblera production d ammoniac vert d autres comme taqa cepsa nareva encore chinois china three gorges e galement e retenus illustrant l inte re t international croissant potentiel marocain maroc peut compter avantage structurel majeur ses ressources renouvelables quasi illimite gra d ensoleillement record re gimes vents puissants provinces sud pays peut produire l hydroge ne vert cou ts parmi plus bas monde proches 2 dollars kg selon l institut recherche e nergie solaire e nergies nouvelles iresen prix repre sente seuil crucial l hydroge ne devienne compe titif face e nergies fossiles l e chelle mondiale l hydroge ne n plus re serve ve hicules pile dont essor aujourde hui largement passe batteries devient cle carboner pans entiers industrie lourde acier engrais ciment aussi remplacer gaz charbon centrales e lectriques c maroc entend jouer ro strate gique l hydroge ne levier souverainete course n mode c bataille ge oe conomique joue grande e chelle pays comme l allemagne lourdement pendants gaz russe fait revirement depuis guerre ukraine berlin pre voit sormais d importer 70 hydroge ne cherche activement partenaires fiables maroc s inscrit clairement strate gie europe enne claration d intention bilate rale germano marocaine e signe e juin 2024 soutenir investissements interconnexions annalena baerbock ministre e trange res allemande affirme occasion maroc ja phare transition re gion plus projet pipeline h2med reliera portugal l espagne france pre voit aussi extension vers maroc offrirait royaume porte d entre e directe vers marche s industriels europe ens terme infrastructure permettrait d exporter l hydroge ne marocain l ammoniac rive plus facilement transportable jusqu usines allemandes franc aises c justement l ammoniac pourrait transformer mode e conomique maroc produit partir d hydroge ne rive ja utilise grande e chelle engrais secteur strate gique pays ocp cinquie exportateur mondial cependant proble matique pose selon laquelle maroc importe encore l ammoniac prix fort 2 milliards dollars an principalement aupre s russie e tats unis situation paradoxale pays posse plus grandes re serves mondiales phosphate veloppant propre production d ammoniac vert royaume pourrait boucler chai ne valeur engrais e nergie renouvelable hydroge ne ammoniac phosphate re sultat renforcement souverainete industrielle monte e gamme ses exportations compe titivite accrue marche mondial estime plus 200 milliards dollars niveau celui l or maroc ne joue simplement carte l hydroge ne re pondre engagements climatiques s agit d choix e conomique strate gique majeur redessine contours politique industrielle e nerge tique diplomatique travers l hydroge ne vert ses rive s royaume peut non seulement pre tendre ro fournisseur strate gique l europe aussi restructuration profonde tissu industriel ambition cre dible condition re ussir l exe cution gouvernance projets l industrialisation rapide filie res chose su re fene tre d opportunite maroc entend bien ne laisser passer,transition e nerge tique pourquoi maroc mise l hydroge ne vert marche mondial hydroge ne repre sente actuellement 100 millions tonnes mutation raison contraintes carbonation poussant grands consommateurs off takers rechercher sources hydroge ne bas carbone fin 2024 environ 75 milliards dollars projets hydroge ne e cide s construction ope ration car clients engage s plus 200 300 milliards dollars projets phase e tude 3 4 prochaines anne contexte maroc n avance plus mesure s l hydroge ne vert acce re validant mars 2025 six projets industriels majeurs re gions laa youne guelmim dakhla montant total 319 milliards dirhams pre s 30 milliards d royaume envoie signal fort veut s imposer comme acteur central marche mondial l hydroge ne vert aspire ainsi couvrir plus 4 demande d 2030 projets porte s consortiums ge ants internationaux notamment allemands ame ricains saoudiens chinois e miratis marocains visent produire l hydroge ne l ammoniac l acier vert encore carburants propres transport maritime ornx exemple regroupe entreprises ortus usa acciona espagne nordex allemagne ciblera production d ammoniac vert d autres comme taqa cepsa nareva encore chinois china three gorges e galement e retenus illustrant l inte re t international croissant potentiel marocain maroc peut compter avantage structurel majeur ses ressources renouvelables quasi illimite gra d ensoleillement record re gimes vents puissants provinces sud pays peut produire l hydroge ne vert cou ts parmi plus bas monde proches 2 dollars kg selon l institut recherche e nergie solaire e nergies nouvelles iresen prix repre sente seuil crucial l hydroge ne devienne compe titif face e nergies fossiles l e chelle mondiale l hydroge ne n plus re serve ve hicules pile dont essor aujourde hui largement passe batteries devient cle carboner pans entiers industrie lourde acier engrais ciment aussi remplacer gaz charbon centrales e lectriques c maroc entend jouer ro strate gique l hydroge ne levier souverainete course n mode c bataille ge oe conomique joue grande e chelle pays comme l allemagne lourdement pendants gaz russe fait revirement depuis guerre ukraine berlin pre voit sormais d importer 70 hydroge ne cherche activement partenaires fiables maroc s inscrit clairement strate gie europe enne claration d intention bilate rale germano marocaine e signe e juin 2024 soutenir investissements interconnexions annalena baerbock ministre e trange res allemande affirme occasion maroc ja phare transition re gion plus projet pipeline h2med reliera portugal l espagne france pre voit aussi extension vers maroc offrirait royaume porte d entre e directe vers marche s industriels europe ens terme infrastructure permettrait d exporter l hydroge ne marocain l ammoniac rive plus facilement transportable jusqu usines allemandes franc aises c justement l ammoniac pourrait transformer mode e conomique maroc produit partir d hydroge ne rive ja utilise grande e chelle engrais secteur strate gique pays ocp cinquie exportateur mondial cependant proble matique pose selon laquelle maroc importe encore l ammoniac prix fort 2 milliards dollars an principalement aupre s russie e tats unis situation paradoxale pays posse plus grandes re serves mondiales phosphate veloppant propre production d ammoniac vert royaume pourrait boucler chai ne valeur engrais e nergie renouvelable hydroge ne ammoniac phosphate re sultat renforcement souverainete industrielle monte e gamme ses exportations compe titivite accrue marche mondial estime plus 200 milliards dollars niveau celui l or maroc ne joue simplement carte l hydroge ne re pondre engagements climatiques s agit d choix e conomique strate gique majeur redessine contours politique industrielle e nerge tique diplomatique travers l hydroge ne vert ses rive s royaume peut non seulement pre tendre ro fournisseur strate gique l europe aussi restructuration profonde tissu industriel ambition cre dible condition re ussir l exe cution gouvernance projets l industrialisation rapide filie res chose su re fene tre d opportunite maroc entend bien ne laisser passer,positive
"Bourse de Casablanca: Le MASI cède 1,30% lundi","16.06.2025 - 16:00

La Bourse de Casablanca entame la semaine sur un net repli, poursuivant son mouvement de consolidation sur fond d’inquiétudes géopolitiques au Moyen-Orient. L’indice MASI cède 1,30% pour clôturer à 18 178,61 points, après avoir testé un plus bas en séance à 18 041,25 points. Le MASI 20 recule de 1,60% à 1 485,73 points

Le volume global des échanges s’est limité à 312 millions de dirhams. TGCC domine les échanges, enregistrant un volume de 47 millions de dirhams à 858,00 dirhams, en baisse de 1,37%. Taqa Morocco a généré 39 millions de dirhams d’échanges, en recul de 2,34%, tandis qu'Addoha a enregistré 32 millions de dirhams de transactions, en cédant 3,86% à 35,60 dirhams, figurant parmi les cinq plus fortes baisses du jour.

Quant à la capitalisation boursière, elle s’est établie à 953 milliards de dirhams, en recul de près de 12 milliards par rapport à la séance précédente.

Coté palmarès, Stroc Industrie mène les hausses avec une progression de 9,96% à 142,95 dirhams.",https://www.boursenews.ma/article/marches/feuille-de-marche,2025-06-17 11:10:55.252822,Boursenews,Taqa Morocco,casablanca masi 1 30 lundi,16 06 2025 16 00 casablanca entame semaine net repli poursuivant mouvement consolidation fond d inquie tudes ge opolitiques moyen orient l indice masi 1 30 clo turer 18 178 61 points apre s teste plus bas ance 18 041 25 points masi 20 recule 1 60 1 485 73 points volume global e changes s limite 312 millions dirhams tgcc domine e changes enregistrant volume 47 millions dirhams 858 00 dirhams 1 37 taqa morocco ge ne re 39 millions dirhams d e changes recul 2 34 tandis addoha enregistre 32 millions dirhams transactions dant 3 86 35 60 dirhams figurant parmi cinq plus fortes baisses jour quant capitalisation boursie re s e tablie 953 milliards dirhams recul pre s 12 milliards rapport ance pre dente cote palmare s stroc industrie ne hausses progression 9 96 142 95 dirhams,casablanca masi 1 30 lundi 16 06 2025 16 00 casablanca entame semaine net repli poursuivant mouvement consolidation fond d inquie tudes ge opolitiques moyen orient l indice masi 1 30 clo turer 18 178 61 points apre s teste plus bas ance 18 041 25 points masi 20 recule 1 60 1 485 73 points volume global e changes s limite 312 millions dirhams tgcc domine e changes enregistrant volume 47 millions dirhams 858 00 dirhams 1 37 taqa morocco ge ne re 39 millions dirhams d e changes recul 2 34 tandis addoha enregistre 32 millions dirhams transactions dant 3 86 35 60 dirhams figurant parmi cinq plus fortes baisses jour quant capitalisation boursie re s e tablie 953 milliards dirhams recul pre s 12 milliards rapport ance pre dente cote palmare s stroc industrie ne hausses progression 9 96 142 95 dirhams,neutral
Bank Of Africa et ses filiales lancent une série de Business Meetings régionaux dédiés aux PME,"Ces rencontres, déclinées sous forme de Workshops thématiques, visent à offrir un accompagnement ciblé aux Petites et Moyennes Entreprises, acteur central de la dynamique économique nationale, indique Bank Of Africa dans un communiqué.



Ces rendez-vous ont pour vocation de sensibiliser les entreprises aux meilleures pratiques en matière de gestion et de financement, de favoriser le dialogue direct entre les experts métiers et les opérateurs économiques et de présenter l’offre globale et complémentaire du Groupe qui facilite aux PME la gestion de leur activité de bout en bout, fait savoir le communiqué.



Programmés courant le mois de juin, les Business meetings régionaux bénéficieront de la mobilisation conjointe des filiales du Groupe, en vue d’apporter toute l’expertise nécessaire aux attentes des entreprises régionales sur différentes thématiques tel que le financement participatif, le Factoring, le Risque de change…, precise la même source.



À travers cette démarche, Bank Of Africa réaffirme sa position d’acteur engagé en faveur de la croissance des PME, en s’appuyant sur la complémentarité de ses expertises internes et l’ancrage régional de ses réseaux.

",https://www.boursenews.ma/article/actualite/BOA-initie-une-serie-de-Business-Meetings-regionaux,2025-06-17 11:11:05.357626,Boursenews,Bank of Africa,bank of africa ses filiales lancent rie business meetings re gionaux die s pme,rencontres cline sous forme workshops the matiques visent offrir accompagnement cible petites moyennes entreprises acteur central dynamique e conomique nationale indique bank of africa communique rendez vocation sensibiliser entreprises meilleures pratiques matie re gestion financement favoriser dialogue direct entre experts tiers ope rateurs e conomiques pre senter l offre globale comple mentaire facilite pme gestion activite bout bout fait savoir communique programme s courant mois juin business meetings re gionaux be ne ficieront mobilisation conjointe filiales vue d apporter toute l expertise ne cessaire attentes entreprises re gionales diffe rentes the matiques tel financement participatif factoring risque change precise source travers marche bank of africa re affirme position d acteur engage faveur pme s appuyant comple mentarite ses expertises internes l ancrage re gional ses re seaux,bank of africa ses filiales lancent rie business meetings re gionaux die s pme rencontres cline sous forme workshops the matiques visent offrir accompagnement cible petites moyennes entreprises acteur central dynamique e conomique nationale indique bank of africa communique rendez vocation sensibiliser entreprises meilleures pratiques matie re gestion financement favoriser dialogue direct entre experts tiers ope rateurs e conomiques pre senter l offre globale comple mentaire facilite pme gestion activite bout bout fait savoir communique programme s courant mois juin business meetings re gionaux be ne ficieront mobilisation conjointe filiales vue d apporter toute l expertise ne cessaire attentes entreprises re gionales diffe rentes the matiques tel financement participatif factoring risque change precise source travers marche bank of africa re affirme position d acteur engage faveur pme s appuyant comple mentarite ses expertises internes l ancrage re gional ses re seaux,negative
LHM : inauguration officielle de la nouvelle usine de clinker et de ciment de Figuil au Cameroun,"

La cérémonie officielle d'inauguration de la nouvelle usine intégrée de production de clinker et de ciment de Figuil s'est tenue le 12 juin 2025 sous la présídence de Son Excellence le Premier Ministre du Carneroun, Dr Joseph Dion Ngute, en présence de plusieurs membres du

Gouvernement camerounais, ainsi que du Président et des membres du Conseil d'administration de LafargeHolcim Maroc Afrique (LHMA).



Cette infrastructure industrielle est portée par CIMFIG, fliale à 100% de CIMENCAM, elle-même détenue à 55% par LHMA.



Dotée ď'une capacité nominale de 500 000 tonnes par an, cette usine de dernière génération, première du genre dans le pays, marque une avancée industrielle majeure pour le Grand Nord du Cameroun. Sa mise en service porte la capacité de production totale de CIMENCAM a 2,3 millions de tonnes, consolidant ainsi sa position de leader du marché camerounais.



Fruit de plusieurs années de planification et d'efforts conjoints cette rẻalisation a nécessité un investissement global de 65 milliards de FCFA, soit plus de 1 milliard de dirhams. Son financement a été assuré par un pool bancaire conduit par la Société Commerciale de Banque du Cameroun

(SCB Cameroun), filiale du Groupe Attijariwafa Bank, agissant en tant que prêteur principal.



Filiale de Lafarge Maroc, Lafarge Holcim Maroc Afrique (LHMA) opère en Afrique subsaharienne francophone, ou elle détient des participations cimentières en Côte d'ivoire, au Cameroun, au Bénin et en Guinėe.

Portée par une vision à long terme, LHMA aspire à une position d'acteur régional de référence å travers l'optimisation de ses actifs à fort potentiel, tirant notamment parti des synergies avec le Groupe Holcim et les sociétés du portefeuille d'Al Mada.",https://www.boursenews.ma/article/marches/LHM-inauguration-usine-Cameroun-Figuil,2025-06-17 11:11:17.438841,Boursenews,"Attijariwafa Bank,Lafarge Holcim Maroc",lhm inauguration officielle nouvelle usine clinker ciment figuil cameroun,re monie officielle inauguration nouvelle usine inte gre e production clinker ciment figuil tenue 12 juin 2025 sous pre dence excellence premier ministre carneroun dr joseph dion ngute pre sence plusieurs membres gouvernement camerounais ainsi pre sident membres lafargeholcim maroc afrique lhma infrastructure industrielle porte e cimfig fliale 100 cimencam tenue 55 lhma dote e d capacite nominale 500 000 tonnes an usine dernie re ge ne ration premie re genre pays marque avance e industrielle majeure grand nord cameroun mise service porte capacite production totale cimencam 2 3 millions tonnes consolidant ainsi position leader marche camerounais fruit plusieurs anne planification efforts conjoints re alisation ne cessite global 65 milliards fcfa plus 1 dirhams financement e assure pool bancaire conduit socie commerciale cameroun scb cameroun attijariwafa bank agissant tant pre teur principal lafarge maroc lafarge holcim maroc afrique lhma ope re afrique subsaharienne francophone tient participations cimentie res co ivoire cameroun be nin guine e porte e vision long terme lhma aspire position acteur re gional re fe rence travers optimisation ses actifs fort potentiel tirant notamment parti synergies holcim socie s portefeuille al mada,lhm inauguration officielle nouvelle usine clinker ciment figuil cameroun re monie officielle inauguration nouvelle usine inte gre e production clinker ciment figuil tenue 12 juin 2025 sous pre dence excellence premier ministre carneroun dr joseph dion ngute pre sence plusieurs membres gouvernement camerounais ainsi pre sident membres lafargeholcim maroc afrique lhma infrastructure industrielle porte e cimfig fliale 100 cimencam tenue 55 lhma dote e d capacite nominale 500 000 tonnes an usine dernie re ge ne ration premie re genre pays marque avance e industrielle majeure grand nord cameroun mise service porte capacite production totale cimencam 2 3 millions tonnes consolidant ainsi position leader marche camerounais fruit plusieurs anne planification efforts conjoints re alisation ne cessite global 65 milliards fcfa plus 1 dirhams financement e assure pool bancaire conduit socie commerciale cameroun scb cameroun attijariwafa bank agissant tant pre teur principal lafarge maroc lafarge holcim maroc afrique lhma ope re afrique subsaharienne francophone tient participations cimentie res co ivoire cameroun be nin guine e porte e vision long terme lhma aspire position acteur re gional re fe rence travers optimisation ses actifs fort potentiel tirant notamment parti synergies holcim socie s portefeuille al mada,neutral
