title,text,url,date,source,content_hash,scraped_at,branch
La Centrafrique a mobilisé 9 Mrds $ à la table ronde de Casablanca,"Selon la MAP, le Premier ministre centrafricain, Félix Moloua, a annoncé que la République centrafricaine a réussi à mobiliser un montant total de 9 milliards de dollars d’engagements lors de la Table ronde d’investissement organisée à Casablanca pour le financement de son Plan national de développement (PND) 2024-2028. De son côté, le ministre de l’Économie, du Plan et de la Coopération internationale de la Centrafrique, Richard Filakota, a fait savoir que cette Table ronde d’investissement a réuni plus de 500 participants, parmi lesquels des bailleurs de fonds, des investisseurs institutionnels et des personnalités venus d’Europe, des États-Unis, du Moyen-Orient, d’Asie et d’Afrique. Cette Table ronde, organisée en partenariat avec le Royaume du Maroc, s’est déroulée dans un esprit de dialogue et de partenariat, placée sous le signe du “donner et du recevoir”.",https://flm.ma/news.php?id=55354,2025-09-21 21:27:28.762174,FLM,906f56337fe851dced5d8785bb16f90f,2025-09-21 21:27:28,corporate finance; asset management
L'info à retenir : Stellantis et AXA finalisent l’acquisition d’AXA Crédit au Maroc,"Le groupe automobile multinational Stellantis et AXA ont annoncé la finalisation de la cession de 80 % du capital d’AXA Crédit, filiale marocaine de crédit à la consommation d’AXA Assurance Maroc. L’opération a été menée par Fidis S.p.A., filiale détenue à 100 % par Stellantis.",https://flm.ma/news.php?id=55365,2025-09-21 21:27:48.421093,FLM,b6d256c9ff915a10ca154f16a1ddcc4a,2025-09-21 21:27:48,corporate finance
"En direct : OCP, Attijariwafa, GPC, Mistral","Ce mardi, nous évoquerons la légère baisse du MASI ainsi que la perspective d’une nouvelle IPO. Aussi, nous nous attardons sur les déclarations du PDG de l’OCP au Matin. De même, nous revenons sur un remaniement à Attijariwafa. Enfin, nous passons en revue la valorisation de Mistral.",https://flm.ma/article.php?id=12652,2025-09-21 21:28:06.548747,FLM,a8a274e5b76eedd00218d72343dcf222,2025-09-21 21:28:06,corporate finance
"Morning meeting : BOA-BMCE, Sanlam, Ferrari, libéralisme, e-commerce","Ce vendredi, nous revenons sur la rechute du MASI ainsi que sur la levée obligataire de BOA-BMCE. Nous évoquons aussi le changement de dénomination de Saham Assurance ainsi que le premier véhicule électrique de Ferrari. De même, nous nous attardons sur la fin de l’exonération des droits de douanes des transactions électroniques. Enfin, nous passons en revue notre consultation online sur le libéralisme économique.",https://flm.ma/article.php?id=10256,2025-09-21 21:28:10.135407,FLM,eca01901c43ae233b466f9d5bb15367c,2025-09-21 21:28:10,corporate finance
L’info à retenir : Mistral AI au Maroc,"Un mémorandum d’entente (MoU) a été signé, vendredi à Rabat, entre le ministère de la Transition numérique et de la Réforme de l’administration et Mistral AI, leader français de l’intelligence artificielle. Cet accord a été paraphé par la ministre déléguée de la Transition numérique et de la Réforme de l’administration, Amal El Fallah, et le cofondateur et CEO de Mistral AI, Arthur Mensch, lors d’une cérémonie tenue en présence de plusieurs personnalités. Dans une déclaration à la presse, Amal El Fallah a relevé que la récente levée de fonds réalisée par Mistral AI ouvre la voie à une coopération étroite avec le Maroc, précisant que cet accord permettra de développer des programmes d’IA en cohérence avec les initiatives marocaines déjà discutées lors des Assises nationales de l’intelligence artificielle. De même, des projets spécifiques seront mis en œuvre dans le domaine linguistique, afin de généraliser l’usage de l’IA dans ce champ essentiel. De son côté, Arthur Mensch a affirmé que Mistral AI se réjouit de travailler avec le Maroc et de lancer cette première étape de coopération. Aussi, il a fait observer que son entreprise collabore déjà avec plusieurs services publics en Europe et ailleurs dans le monde, ajoutant que Mistral AI ambitionne de renforcer sa présence dans le Royaume en développant des partenariats tant avec le secteur public que privé.",https://flm.ma/news.php?id=55337,2025-09-21 21:28:21.704487,FLM,bb4e36a0aa1e9bb97f6b0bb2c168c8a4,2025-09-21 21:28:21,corporate finance; asset management; private equity
Stellantis et AXA finalisent l’acquisition d’AXA Crédit au Maroc,"Le groupe automobile multinational Stellantis et AXA ont annoncé la finalisation de la cession de 80 % du capital d’AXA Crédit, filiale marocaine de crédit à la consommation d’AXA Assurance Maroc. L’opération a été menée par Fidis S.p.A., filiale détenue à 100 % par Stellantis.",https://flm.ma/news.php?id=55358,2025-09-21 21:28:44.440984,FLM,954e17f2c1fe590a463457740c3005cd,2025-09-21 21:28:44,corporate finance
Wall Street termine la semaine en vert,"La Bourse de New York a conclu vendredi par une séance de hausse après une semaine ponctuée par un cycle d'assouplissement monétaire aux Etats-Unis après la baisse de taux décidée par la Réserve fédérale. L'indice Dow Jones a gagné 0,37%. Le Standard & Poor's 500 a pris 0,49% . Le Nasdaq a avancé de 0,72%. Sur la semaine, le Dow a gagné 1,05%, le S&P 1,22% et le Nasdaq 2,21%.",https://flm.ma/news.php?id=55381,2025-09-21 21:29:00.483719,FLM,4e18bc71359d42f224223daa97fca541,2025-09-21 21:29:00,asset management
Wall Street réagit à la baisse des taux de la FED,"Wall Street a clôturé mercredi sur une note mitigée, même si la Réserve fédérale américaine (FED) a réduit ses taux d’un quart de point. Ainsi, le Dow Jones a gagné 0,57% à 46.018,32 points, le S&P 500 a perdu 0,10% à 6.600,35 points, et le Nasdaq a reculé de 0,32% à 22.261,33 points. Notons que cette première baisse des taux directeurs de la banque centrale américaine de l'année, était largement anticipée par les marchés. En outre, Jerome Powell a modéré l'enthousiasme des marchés quant à une politique monétaire plus agressive, réservant une baisse plus importante des taux pour des conditions plus graves qui ne sont pas présentes aujourd'hui.",https://flm.ma/news.php?id=55366,2025-09-21 21:29:05.633099,FLM,5f72b873dbd2d4302f471a61534b8599,2025-09-21 21:29:05,asset management
Multiplication par 14 de la marge de raffinage de TotalEnergies,"TotalEnergies a réalisé au deuxième trimestre 2022 un résultat net ajusté de 9,8 Mrds $ et un résultat net IFRS de 5,7 Mrds $. TotalEnergies a en effet inscrit dans ses comptes une nouvelle provision de 3,5 Mrds $ liée principalement à la prise en compte de l’impact potentiel des sanctions internationales sur la valeur de sa participation dans Novatek. Pour dégager ces super-profits, la multinationale française a notamment profité d’une hausse de 65% du cours du brut ainsi que d’une multiplication par 14 de la marge de raffinage.",https://flm.ma/news.php?id=47410,2025-09-21 21:29:10.305820,FLM,d54e86fc22d096badb76d283a3461530,2025-09-21 21:29:10,corporate finance
Vers une année 2025 tonique pour le crédit bancaire,"Bank Al-Maghrib (BAM) a publié son récent tableau de bord ""Crédits-Dépôts bancaires"". Il en ressort une hausse significative de l’encours des crédits bancaires soutenue par une demande stable aussi bien de la part des entreprises que des ménages. En parallèle, les dépôts connaissent également une progression notable, reflétant la confiance des acteurs économiques dans le système bancaire marocain. Le financement participatif, en particulier dans le secteur immobilier, poursuit son essor, contribuant à diversifier les sources de financement.",https://flm.ma/article.php?id=12667,2025-09-21 21:29:41.483775,FLM,86d5819124305376cb2830015b0d3402,2025-09-21 21:29:41,corporate finance
De nouveaux projets d’hydrogène vert pour 319 Mds DH,"Le comité de pilotage de « l’Offre Maroc » en matière d’hydrogène vert a acté plusieurs avancées. La phase préliminaire du projet « Chbika 1 » a été clôturée avec succès, ouvrant la voie à des études avancées menées par un consortium franco-danois. Par ailleurs, cinq investisseurs nationaux et étrangers ont obtenu la réservation de foncier pour six projets dans les régions du Sud, représentant un investissement global de 319 Mrds DH.",https://flm.ma/news.php?id=55367,2025-09-21 21:29:49.905781,FLM,7eae16abebaac35137a18a579f682ec0,2025-09-21 21:29:49,real estate
Retour sur la titrisation des Eurobonds Maroc par CIH,"L’AMMC a annoncé que le Compartiment « FT Relevium–Compartiment I » du Fonds de Placements Collectifs en Titrisation « FT Relevium » a reçu le visa de son Document d’Information, en date du 31/12/2021. L’opération porte sur la titrisation d’un portefeuille de titres Eurobonds Maroc détenu par CIH Bank. Le montant total de l’émission est fixé à 558,6 MDH. La période de souscription s’étalera du 10/01/2022 au 13/01/2022, inclus.",https://flm.ma/article.php?id=9896,2025-09-21 21:30:11.002069,FLM,d13aa516927d759e97c4befa5dbaadff,2025-09-21 21:30:11,asset management
"En direct : PIB régional, flux extérieurs, Butane, pêche","Ce mardi, nous évoquerons la légère hausse du MASI ainsi que le comportement des flux extérieurs. Aussi, nous nous attardons sur l’accentuation des disparités entre les régions selon le PIB. De même, nous revenons sur la volatilité du prix du Butane. Enfin, nous passons en revue les derniers chiffres de la pêche.",https://flm.ma/article.php?id=12645,2025-09-21 21:30:17.517938,FLM,26b559abbe1e684ecc0313e55b28d902,2025-09-21 21:30:17,asset management
Fitch dégrade la note de la France,"Fitch a abaissé vendredi la note de crédit à long terme de la France à A+ avec perspective stable, contre AA- précédemment, l'agence de notation soulignant que l'augmentation de la dette publique limite la capacité du pays à réagir à de nouveaux chocs sans aggraver la situation des finances publiques. En effet, la France prévoit un déficit public de 5,4% du PIB en 2025, au-dessus de la limite de 3% fixée par les règles budgétaires européennes. Aussi, la dette dépasse ainsi désormais 3.300 milliards d'euros, soit presque 114% du PIB. Pour sa part, le ministre de l'Economie démissionnaire, Eric Lombard, a dit prendre acte de la décision de Fitch, la disant motivée par la situation des finances publiques et l'incertitude politique, malgré la solidité de l'économie française.",https://flm.ma/news.php?id=55333,2025-09-21 21:30:31.638820,FLM,f6253bb4fb9bdcdd88a5f0a78ead3049,2025-09-21 21:30:31,corporate finance
GPC affiche ses ambitions,"GPC Papier et Carton, a annoncé un investissement 500 millions de dirhams pour agrandir son site de Mohammedia, en portant sa capacité de production annuelle de 90.000 tonnes à 160.000 tonnes d’ici 2030, et créer plus de 100 emplois directs à l’horizon 2027. Filiale du Groupe YNNA, GPC se présente comme le leader national de l’emballage en papier et carton ondulé. En outre, GPC a rappelé avoir structuré, en partenariat avec Maghreb Titrisation, le premier fonds de titrisation verte dédié au secteur de l’emballage au Maroc, pour un montant de 250 millions de dirhams. Enfin, selon la presse électronique, GPC devrait franchir le pas de la cotation, sous réserve d’obtention du visa de l’AMMC.",https://flm.ma/news.php?id=55344,2025-09-21 21:30:47.322343,FLM,c6572a7ba343260ada38dd6fedb02c1e,2025-09-21 21:30:47,asset management
Taux directeur : BMCE Capital prévoit le maintien du statuquo,"""Si le sondage desreste très partagé, nous privilégions, pour notre part, le maintien du statuquo pour notre scénario central avec une perspective baissière d'ici fin 2025"", indiquedans un ""Flash Strategy"" publié jeudi.Pour ce qui est du sondage, effectué par BKGR auprès de plusieurs investisseurs institutionnels marocains dans le cadre de l'élaboration de ce document, il révèle que 89% des participants estiment que laactuelle est adéquate.En outre, 56% des sondés anticipent une baisse des taux de 25 points de base (pbs) du Conseil du 23 septembre 2025, alors que 33% des participants considèrent que le niveau cible dud'ici fin 2025 est de 2%, ce qui suppose au moins une baisse pour cette année, soit lors du prochain Conseil, soit à l'occasion de celui de décembre.souligne aussi que le troisièmede cette année intervient dans un contexte international toujours marqué par une volatilité accrue des prix de l'énergie, la poursuite des tensions géopolitiques au Moyen-Orient et le maintien des incertitudes liées à la nouvelle politique commerciale américaine.Dans ce climat particulier, lesfont face à des arbitrages délicats afin de trouver un juste équilibre entre soutien à la croissance et préservation de la",https://lematin.ma/economie/taux-directeur-bmce-capital-prevoit-le-maintien-du-statuquo/302542,2025-09-19 11:34:00.000000,Le Matin,0e733933e688b02360095de71b65ad61,2025-09-21 21:31:05,asset management
"Oulmès : Les profits en hausse de 33,4% au premier semestre 2025","Le chiffre d’affaires consolidé des’est établi à 1,5 milliard de dirhams à fin juin 2025, en hausse de 11% par rapport au premier semestre 2024. Cette progression s’explique par la bonne tenue des volumes de vente et par l’optimisation continue des capacités industrielles. Le chiffre d’affaires est porté notamment par une demande soutenue sur leset par l’élargissement de la couverture commerciale.L’efficacité des efforts déployés pour rationaliser les coûts et améliorer les processus se traduit également par une progression significative des indicateurs de rentabilité. L’EBITDA consolidé s’élève à 269,5 millions de dirhams, en hausse de 16,7%, tandis que l’EBITDA social atteint 232 millions de dirhams, en progression de 17%. Ces résultats confirment l’impact positif des programmes d’excellence opérationnelle et de l’optimisation des lignes de production.Sur une base sociale,affiche un résultat net de 33,2 millions de dirhams, en amélioration de 22,7% par rapport à l’année précédente. Ce niveau de performance reflète une trajectoire solide, soutenue par la croissance des revenus, la discipline budgétaire et la rentabilité industrielle.",https://lematin.ma/economie/oulmes-les-profits-en-hausse-de-334-au-premier-semestre-2025/302285,2025-09-18 11:27:00.000000,Le Matin,3b2b3f57c348134f20e1b5275889e1c1,2025-09-21 21:31:07,corporate finance
Le Maroc obtient 100 millions d’euros supplémentaires du Fonds de l’OPEP,"Lepour le développement international vient d’approuver 100 millions d’euros en faveur du. Ces Fonds sont destinés à soutenir la seconde phase du Programme d’appui à la gouvernance économique et à la résilience au. Leavait déjà accordé en 2024 un montant similaire pour la première phase de ce Programme cofinancé avec la. Pour rappel, la BAD avait approuvé 120 millions d’euros pour cette première phase, puis renforcé son appui en juin 2025 avec un engagement supplémentaire de 181,8 millions d’euros pour la deuxième phase.Couvrant la période 2024-2026, le Programme vise à soutenir la dynamique économique marocaine tout en renforçant sa résilience face aux chocs exogènes, notamment climatiques, afin de permettre au pays d’atteindre un palier supérieur de croissance. Il s’inscrit dans la mise en œuvre du, qui entend répondre aux défis économiques et environnementaux. Le Programme vise ainsi à contribuer à un modèle où l’État se recentre sur ses fonctions stratégiques et de régulation sectorielle, tandis que ledevient le principal moteur de création de richesses et d’emplois. Le Programme soutient, également, la transition vers un développement durable, afin de réduire la vulnérabilité du cadre macroéconomique aux facteurs extérieurs, tels que la raréfaction de l’eau ou la hausse des prix de l’énergie.L’initiative repose sur deux composantes. La première cherche à réaliser le potentiel de croissance de l’économie en améliorant sa compétitivité, notamment par la redéfinition du rôle de l’État et la création d’un environnement de marché plus concurrentiel, favorable aux investissements privés. La seconde vise à renforcer la résilience de l’face aux chocs exogènes, y compris climatiques, grâce à la modernisation de la gouvernance sectorielle (eau, électricité), au développement d’infrastructures durables et à l’intégration des impératifs climatiques dans les politiques publiques. Dans la continuité de la première phase, cette deuxième étape doit consolider les progrès réalisés et approfondir les réformes engagées.Créé en 1976, leest une institution de financement qui soutient exclusivement les pays en développement. Alimenté par les contributions de ses États membres, il agit en partenariat avec les gouvernements et la communauté internationale pour stimuler la croissance économique et le progrès social. Son action est centrée sur les besoins essentiels des pays en développement, notamment l’énergie, l’eau et l’assainissement, la santé, l’éducation, l’alimentation, les infrastructures et l’emploi, avec une attention particulière portée aux petites et moyennes entreprises. n",https://lematin.ma/economie/le-maroc-obtient-100-millions-deuros-supplementaires-du-fonds-de-lopep/302777,2025-09-20 16:08:00.000000,Le Matin,e1eb62c9a7daf3b76e85bd580cc20d46,2025-09-21 21:31:11,corporate finance; asset management
Ménara Préfa inaugure à Safi une unité industrielle dédiée aux solutions en béton,"Une plateforme moderne pour répondre à la demande en matériaux Un levier d’emploi et de dynamisme local , filiale de, vient d'inaugurer sa nouvelle unité industrielle de production de. La cérémonie s’est déroulée en présence du ministre de l’Industrie et du Commerce,, et du président de Ménara Holding,. Il s’agit de la cinquième implantation du groupe, déjà présent à. Avec ce nouveau site, l’entreprise confirme sa volonté de mailler le territoire national et d’accompagner le développement économique des régions.Pensée comme un véritable, la nouvelle unité s’articule autour de trois axes de production : uneprêt à l’emploi, une ligne de fabrication de, et une unité de poutrelles précontraintes.Cette infrastructure de pointe a nécessité un investissement de 90,8 millions de dirhams. Elle affiche déjà un chiffre d’affaires de 107,64 millions de dirhams, preuve de son efficacité et de la demande soutenue dans le. Elle répond non seulement aux besoins croissants en solutions constructives, mais elle s’inscrit aussi dans une logique de développement durable, chère au groupe.Au-delà de l’aspect industriel, le projet a un impact direct sur le tissu socio-économique local. Pas moins de 106 emplois directs et 159 indirects ont été créés grâce à cette nouvelle implantation, favorisant l’insertion professionnelle et renforçant le tissu économique de la. Cettes’inscrit dans le cadre d’une convention signée avec leen avril 2021. Une collaboration public-privé qui illustre la volonté commune de stimuler la production locale et de renforcer l’attractivité industrielle du Royaume.« Avec cette implantation àrenforce la dynamique territoriale du Royaume, portée par un capital marocain engagé dans le», a souligné le ministre. Il a également rappelé que la filière duest en plein essor, avec un chiffre d’affaires de plus de 16 milliards de dirhams en 2024, en hausse de 17% par rapport à 2022.Depuis sa création en 2002,s’est imposée comme un acteur clé dans la production de béton et de solutions préfabriquées. Avec plus de 1.100 collaborateurs, l’entreprise poursuit une vision claire : allier innovation, excellence industrielle et ancrage territorial.",https://lematin.ma/economie/menara-prefa-inaugure-a-safi-une-unite-dediee-aux-solutions-en-beton/302613,2025-09-19 14:30:00.000000,Le Matin,0e5bc96e65ae249be07ceb38f6c93476,2025-09-21 21:31:15,corporate finance
OCP Nutricrops veut valoriser le carbone de la plateforme de Jorf Lasfar,"Dessalement : vers une résilience hydrique portée par le carbone capté Innovation agricole : le CO₂ au service de la nutrition végétale Une stratégie alignée avec la neutralité carbone du Groupe OCP a annoncé la signature de deux protocoles d’accord avecet. Ces partenariats visent à faire ducapté sur laune ressource industrielle à part entière. L’enjeu : inscrire ce gaz jusque-là considéré comme un résidu dans un modèle circulaire au service de la durabilité.Dès 2027, les unités deseront dotées de modules de capture de, capables de générer des volumes significatifs de. Ces volumes alimenteront à la fois les projets demenés par OCP Green Water et les développements technologiques d’INNOVX en matière d’et de solutions à faible teneur en carbone.Le premier protocole signé entre OCP Nutricrops et OCP Green Water ouvre la voie à l’utilisation du CO₂ capté pour soutenir des projets de dessalement à grande échelle. Le gaz intervient notamment dans le processus d’ajustement du pH et de reminéralisation, rendant l’eau issue du dessalement compatible avec les usages industriels et domestiques.Cette initiative s’inscrit pleinement dans ledu, qui vise la neutralité carbone à l’horizon 2040 et le recours exclusif à des sources d’énergie renouvelables d’ici 2027. À travers OCP Green Water, le groupe ambitionne également de couvrir l’ensemble de ses besoins en eau via des ressources non conventionnelles.Le second protocole, signé avec INNOVX, porte sur l’exploitation du CO₂ capté dans le développement de nouvelles. Les partenaires s’engagent à concevoir dessur-mesure à base de carbone, adaptés aux besoins des agriculteurs à l’échelle mondiale.Ce projet inclut notamment une valorisation croisée du carbone et du phosphogypse issus des procédés de Nutricrops, en vue de produire du sulfate d’ammonium à faible impact carbone. L’ambition est double : renforcer la sécurité alimentaire et accompagner les transitions écologiques des secteurs agricoles et industriels.À travers ces accords, OCP Nutricrops traduit concrètement la stratégie climatique du Groupe OCP, fondée sur deux piliers : réduire sonet aider lesà verdir leurs pratiques. La capture et la valorisation du CO₂ deviennent ainsi un axe structurant de cette transformation.« L'agriculture est aujourd'hui confrontée à des défis sans précédent. Nous pensons que ces défis doivent être transformés en opportunités », a déclaré Youssef El Bari, CEO d’OCP Nutricrops. Un engagement partagé par Ahmed Mahrou, directeur de la SBU Manufacturing, qui rappelle que « la décarbonation n’est pas seulement un tournant technologique, mais une vision industrielle responsable. »Ces initiatives confirment le rôle pionnier d’OCP dans l’intégration industrielle du carbone et la construction d’un modèle circulaire fondé sur l’innovation, la durabilité et la souveraineté hydrique.",https://lematin.ma/economie/ocp-nutricrops-veut-valoriser-le-carbone-de-la-plateforme-de-jorf-lasfar/302570,2025-09-19 12:29:00.000000,Le Matin,32bc526036fcdd40bc7254c270998df9,2025-09-21 21:31:44,corporate finance
Les bénéfices de la Banque Populaire en hausse de 12% au premier semestre 2025,"Le Produit Net Bancaire (PNB) consolidé enregistre une croissance de 8,4%, pour s’établir à 13,9 milliards de dirhams. Cette performance est tirée à la fois par la progression du core banking business (marge d’intérêts et commissions), qui s’élève à 9,5 milliards de dirhams (+3,7%), et par la forte performance des activités de marché, en hausse de 20,2% à 3,9 milliards de dirhams.La maîtrise des charges demeure un axe central de la stratégie du Groupe. Les frais généraux progressent légèrement de 1,8%, pour s’établir à 5,7 milliards de dirhams. Cette évolution modérée permet au coefficient d’exploitation de s’alléger de 2,7 points sur une année glissante, pour s’établir à 40,7%, témoignant d’une amélioration de l’efficacité opérationnelle.Ledu Groupe s’améliore de 16,8% à 3,5 milliards de dirhams, renforçant la rentabilité globale du groupe bancaire. Lereste maîtrisé, avec un recul marginal de 0,2% à 2,7 milliards de dirhams, fruit d’un effort de recouvrement soutenu et d’une politique de provisionnement prudente.Lecontinue de renforcer sa base financière. Son fonds de soutien spécifique au modèle coopératif atteint 4,2 milliards de dirhams, en hausse de 7,2% sur un an. Par ailleurs, la Provision pour Risques Généraux (PRG) reste solide à 7,1 milliards de dirhams, illustrant la résilience du groupe face aux incertitudes économiques.",https://lematin.ma/economie/les-benefices-de-la-banque-populaire-en-hausse-de-12-au-s1-2025/302256,2025-09-18 10:50:00.000000,Le Matin,bace34bb53e00b52c2da349279f24d4c,2025-09-21 21:31:47,corporate finance; asset management
