title,text,url,date,source,content_hash,scraped_at,branch
Al Moutmir : plus de 1.100 plateformes de démonstration boostent les rendements céréaliers et légumineux,"+21 % à +23 % pour les céréales, +26 % à +33 % pour les légumineuses, par rapport aux parcelles témoins. Un impact économique et social tangible Un dispositif de recherche et de transfert de connaissances fertilisation raisonnée sur la base d’analyses de sol, raisonnée sur la base d’analyses de sol, protection intégrée des cultures, gestion rationnelle de l’eau , , solutions spécialisées adaptées aux besoins locaux. Une dynamique d’innovation ouverte Au total, 1.102ont été installées dans 24 provinces et plus de 120 communes, dont 876 pour leset 226 pour les, impliquant directement 275 agriculteurs. Plus de 600ont concerné le semis direct, technique mise en avant dans le cadre du programme national pour renforcer la résilience face auLes résultats indiquent une amélioration notable desLea permis en moyenne 20 % de gain par rapport auxLesont également montré une amélioration de la rentabilité des exploitations grâce à une meilleure efficience des intrants et à l’optimisation des coûts. Lesse sont accrues de +33 % à +54 %, confirmant l’intérêt desoptimisés.Par ailleurs, plus de 3.000ont été sensibilisés indirectement via les écoles aux champs, deset lescommeChaque plateforme s’appuie sur le référentiel de(ICP), structuré autour de quatre piliers :Les analyses réalisées par lesdéployés à l’échelle nationaleainsi quepermettent d’adapter la fertilisation grâce au, outil de production d’engrais sur mesure.Ces résultats ont été présentés lors de la 17ᵉ édition de l’, tenue le 19 septembre 2025 à l’UM6P de Benguerir. L’événement a réuni environ 70 participants (institutionnels, chercheurs, agronomes, organisations professionnelles et agriculteurs) et a mis en avant des thématiques comme la Green Génération, le, la, la diversification et les opportunités liées à la",https://lematin.ma/economie/al-moutmir-1102-plateformes-de-demonstration-boostent-les-rendements/302765,2025-09-20 14:42:00.000000,Le Matin,150620124f93cd7fab61883fd8e89fd7,2025-09-21 21:31:51,asset management
OCP Nutricrops signe deux partenariats pour la valorisation du CO₂ capturé sur la plateforme industrielle de Jorf Lasfar,"OCP Nutricrops a signé, le mercredi 17 septembre, avec OCP Green Water et Innovx deux mémorandums d’entente pour réduire son empreinte carbone et valoriser industriellement le CO₂ capturé sur la plateforme de Jorf Lasfar, en le transformant en solutions durables pour l’eau et l’agriculture. À partir de 2027, des unités de production d’engrais seront équipées de modules de capture carbone, avec une capacité de CO₂ annuelle significative. Ces volumes sont conçus non seulement pour répondre aux besoins de OCP Green Water pour ses projets de dessalement et à ceux d’Innovx pour la production de solutions riches en carbone et en soufre ; mais aussi pour servir l’industrie marocaine au sens large, en fournissant une nouvelle source d’apport en carbone, fait savoir OCP Nutricrops. Cette étape permettra également à OCP Nutricrops de réduire son empreinte carbone à travers des modèles de production plus écologiques, et d'aider les agriculteurs à décarboner leurs activités grâce à des solutions innovantes. Résilience hydrique Le premier MoU, signé entre OCP Nutricrops et OCP Green Water, vise à utiliser le CO₂ capturé provenant des plateformes industrielles de la SBU Manufacturing pour soutenir des initiatives de dessalement à grande échelle. Le CO₂ joue un rôle important dans le dessalement en aidant à ajuster le pH et en favorisant la reminéralisation, rendant l’eau adaptée aux usages domestiques et industriels. (Publicité) (Publicité) Le mémorandum établit également un cadre pour la gestion de l’approvisionnement et de la logistique, garantissant une base de ressources fiable et durable pour les projets de résilience hydrique. Agriculture et innovation industrielle Le second mémorandum, signé entre OCP Nutricrops et Innovx, tend à utiliser le CO₂ capturé pour faire progresser l’innovation dans les applications agricoles et industrielles. À travers cette collaboration, les partenaires développeront conjointement de nouvelles solutions à base de carbone. Cela permettra d’élargir l’accès à des solutions de nutrition végétales customisables pour les agriculteurs du monde. ""Le protocole d'accord signé aujourd'hui constitue une étape importante dans notre démarche de décarbonation, en soutenant la production d'engrais verts ainsi que les ambitions plus larges du groupe OCP et du Maroc en matière de dessalement et de croissance industrielle, grâce à un approvisionnement local fiable en carbone"", a expliqué Youssef El Bari, CEO d'OCP Nutricrops, cité dans le communiqué. Si vous voulez que l'information se rapproche de vous Suivez la chaîne Médias24 sur WhatsApp © Médias24. Toute reproduction interdite, sous quelque forme que ce soit, sauf autorisation écrite de la Société des Nouveaux Médias. Ce contenu est protégé par la loi et notamment loi 88-13 relative à la presse et l’édition ainsi que les lois 66.19 et 2-00 relatives aux droits d’auteur et droits voisins.",https://medias24.com/2025/09/19/ocp-nutricrops-signe-deux-partenariats-pour-la-valorisation-du-co%e2%82%82-capture-sur-la-plateforme-industrielle-de-jorf-lasfar/,2025-09-19 00:00:00.000000,Medias24,90dc1bfebbca3e8a2c33971ac3c0e8af,2025-09-21 21:32:17,corporate finance
"Taux directeur. Le statu quo, scénario le plus probable","À l’approche de la réunion du Conseil de Bank Al-Maghrib, prévue le 23 septembre 2025, Médias24 propose son analyse des perspectives de la politique monétaire. Dans ce contexte, le maintien du taux directeur à 2,25% est l’option la plus probable. Le mardi 23 septembre, le Conseil de Bank Al-Maghrib se réunira pour statuer sur le taux directeur et définir la politique monétaire du quatrième trimestre 2025. À l’approche de cette échéance, les spéculations sur l’orientation de la décision s’intensifient. Ainsi, et à l’instar des trimestres précédents, Médias24 propose une analyse approfondie des indicateurs macroéconomiques arrêtés à fin juillet-août 2025, selon les données officielles disponibles, afin de dégager le scénario le plus probable au regard du tableau de bord de l’économie nationale. L’analyse couvre plusieurs agrégats, dont l’inflation, l’emploi, les finances publiques, les échanges commerciaux, etc. (Publicité) (Publicité) L'inflation Sur 12 mois aglissants: À fin juillet 2025, l’inflation reste contenue, avec une variation annuelle de l’IPC limitée à 0,5%, conséquence d’une hausse modérée des prix alimentaires de 0,9% et des prix non alimentaires de 0,2%. En variation mensuelle, l’IPC recule légèrement de 0,1%, tiré par la baisse des prix alimentaires de 0,5%, alors que les prix des produits non alimentaires progressent de 0,2%. Évolution moyenne depuis le début de l'année: Sur la moyenne des sept premiers mois de 2025, l’IPC a progressé de 1,2% par rapport à la même période de 2024. Par ailleurs, l’indicateur d’inflation sous-jacente, qui exclut les prix volatils et réglementés, enregistre une baisse de 0,1% sur un mois et une hausse de 0,9% en glissement annuel. Ces données traduisent la poursuite de la phase désinflationniste au Maroc. L’inflation reste maîtrisée et évolue désormais bien en deçà des seuils d’alerte, sans exposer l’économie à un risque de désancrage inflationniste. Dans ce contexte, une détente immédiate aurait un effet limité sur la consommation. L’élasticité entre le taux directeur et le crédit aux ménages demeure structurellement faible, comme le montre l’historique des variations de taux comparé aux flux de crédit aux ménages. Une baisse de 25 pb n’affecte pas réellement les arbitrages de consommation/épargne. Cette faible élasticité est le résultat de la structure financière du pays, marquée par un taux de bancarisation encore limité et par l’aversion au risque de la part des banques. La croissance Les dernières projections officielles fixent la croissance réelle à 4,4% en 2025, avec une valeur ajoutée agricole attendue à 4,7% et une valeur ajoutée non agricole à 4,3%. Ces chiffres doivent être lus à la lumière d’un facteur clé, l’année agricole jugée prometteuse par le chef du gouvernement et d'autres spécialistes, avec de bonnes perspectives pour les légumes, les olives et les agrumes. Le rebond agricole n’est pas seulement un effet de volume, il agit sur le revenu rural et donc sur la demande intérieure. Mais le moteur structurel demeure le non-agricole. Les services, l’industrie manufacturière et notamment le BTP, porté par l’essor des investissements publics en cours, assurent une base solide. La question centrale n’est pas la croissance en elle-même, mais sa qualité. La dépendance persistante au cycle agricole rappelle que l’investissement productif privé reste timide et que la consolidation de la croissance repose encore largement sur les investissements publics, lesquels, au-delà des questions de multiplicateur budgétaire et d’efficience, demeurent en fin de compte financés majoritairement par la dette. Et c’est là que la politique monétaire joue un rôle secondaire, elle ne crée pas la croissance, elle l’accompagne. Le marché du travail Au T2-2025, le marché de l’emploi a connu une amélioration très limitée, avec une création nette de seulement 5.000 à 6.000 emplois par rapport à la même période de 2024. La dynamique a été portée par la création de 113.000 emplois en milieu urbain, contre une perte de 107.000 en milieu rural. L’agriculture, la forêt et la pêche ont perdu 108.000 postes. À l’inverse, le BTP a créé 74.000 emplois, les services 35.000 et l’industrie 2.000. Cette configuration souligne une reprise concentrée dans les branches non agricoles, en particulier les activités urbaines. Par type, l’emploi rémunéré a progressé de 132.000 postes, compensant partiellement la perte de 126.000 emplois non rémunérés. Le taux de chômage s’établit à 12,8%, en baisse de 0,3 point sur un an. Le chômage atteint 35,8% chez les jeunes de 15 à 24 ans, 19% chez les diplômés et 19,9% chez les femmes. Le sous-emploi s’est nettement aggravé. Le nombre de personnes concernées est passé de 1.042.000 à 1.147.000, soit un taux de 10,6% contre 9,6% un an auparavant. L’image d’ensemble montre un marché du travail encore tendu. Les créations d’emplois en milieu urbain ne suffisent pas à compenser les pertes en zone rurale et la qualité des emplois avance trop lentement. Une bonne campagne agricole à l’automne pourrait apporter un soutien à court terme à la création d’emplois aux T3 et T4, mais les déséquilibres de fond restent présents. En termes d’implications pour la politique monétaire, et dans de telles conditions, on peut penser à un assouplissement du taux directeur. Mais la structure du marché de l’emploi dicte une autre réalité. L’élasticité de l’emploi à la politique monétaire est limitée. Les données historiques montrent d’ailleurs une corrélation faible entre le stock de l’emploi et le flux des crédits aux sociétés non financières privées (SNFP), même avec différents décalages temporels. Baisser le taux directeur ne résout pas le chômage structurel, qui relève davantage de la politique budgétaire et de l’investissement sectoriel. Les finances publiques La situation des charges et ressources du Trésor au titre du mois d’août, émanant du MEF, laisse apparaître un déficit budgétaire de 59,8 MMDH, en hausse de 48,1% par rapport à la même période en 2024, traduisant une progression des dépenses plus rapide que celle des recettes. Dans le détail, les recettes ordinaires ont progressé de 13,2% en glissement annuel pour atteindre 257,8 MMDH, tirées par la hausse soutenue des recettes fiscales en augmentation de 15,1%, portée notamment par l'IR en hausse de 18,3% et l’IS en nette augmentation de 31,3%. En revanche, les recettes non fiscales se sont établies à 30,2 MMDH, en hausse de 2,2%, grâce aux versements des établissements et entreprises publics, mais atténuées par le recul des financements innovants. Du côté des dépenses, les charges ordinaires ont crû de 14,5% sous l’effet combiné de l’augmentation des dépenses de biens et services en hausse de 18,4% et des charges d’intérêts de la dette en progression de 18,8%. Les dépenses d’investissement ont atteint 67,9 MMDH, en hausse de 3,7%. Par ailleurs, il est à noter que la politique budgétaire joue le rôle contracyclique que la politique monétaire ne peut assumer seule. Mais elle le fait au prix d’un besoin de financement croissant. Celui-ci est couvert essentiellement par le marché intérieur, ce qui exerce une pression sur l’épargne nationale et sur le coût de financement. Crédit et agrégats monétaires L’analyse des statistiques monétaires de Bank Al-Maghrib à fin juillet 2025 révèle une décélération du rythme de progression du crédit bancaire au secteur non financier, dont la croissance s’est établie à 3,4% en glissement annuel. Dans le détail, les crédits aux sociétés non financières privées stagnent presque, affichant une progression modeste de 1,2% en glissement annuel. En revanche, les prêts aux ménages s’accélèrent légèrement, avec une hausse de 2,9%. Par objet économique, les crédits à l’équipement progressent fortement de 15,2%. Les crédits immobiliers enregistrent une hausse contenue de 3,4%, tandis que les prêts à la consommation accélèrent à 3,9%. Sur le plan monétaire, la masse monétaire M3 atteint 1.970,3 MMDH, en progression annuelle de 7,7%. Cette évolution reflète à la fois l’expansion des dépôts à vue de 11,2% sur un an et la hausse de la circulation fiduciaire de 8,7%. Les échanges extérieurs La balance commerciale à fin juillet 2025 continue de se détériorer, avec un déficit qui s’élève à 194,9 MMDH, en aggravation de 15,9% par rapport à la même période de 2024. Cette évolution résulte d’une progression vigoureuse des importations de 8,8%, atteignant 469,7 MMDH, contre une hausse modeste des exportations de 4,2%, à 274,8 MMDH. Le taux de couverture perd ainsi 2,6 points, traduisant un affaiblissement relatif de la capacité des exportations à compenser la facture des importations. Du côté des importations, la hausse est particulièrement marquée dans les produits finis d’équipement et les produits finis de consommation, ce qui reflète un maintien de la demande intérieure mais aussi une forte dépendance aux intrants et biens durables étrangers. En revanche, la facture énergétique recule de 6,1%, grâce notamment à la baisse des approvisionnements en gasoil et fuel de 14,2% sous l’effet prix. Les exportations, quant à elles, progressent globalement mais de façon contrastée. Les phosphates et dérivés bondissent de 20,9%, profitant d’une demande soutenue, alors que les exportations automobiles reculent de 1,8% et les exportations textiles de 3,3%, signe d’une fragilité sectorielle. Dans ce contexte, le solde des services joue un rôle crucial de stabilisateur. Il affiche un excédent en hausse de 10,8%, atteignant 82,1 MMDH, soutenu par des recettes touristiques dynamiques en progression de 12,6% à 67,1 MMDH. En revanche, les transferts des MRE reculent légèrement de 1%, à 68,8 MMDH. Les IDE confirment une tendance positive avec une progression du flux net de 25,6%, atteignant 16,9 MMDH à fin juillet 2025. Statu quo : l’option la plus probable À la lumière du tableau de bord macroéconomique arrêté à fin juillet-août 2025, le scénario le plus probable demeure celui d’un statu quo du taux directeur à 2,25%. À ce niveau, la politique monétaire de Bank Al-Maghrib est déjà accommodante. Elle soutient l’activité sans générer de pressions inflationnistes et conserve une marge de manœuvre en cas de choc. Dans une économie comme la nôtre, où l’élasticité de la demande au coût du crédit demeure structurellement faible, un assouplissement supplémentaire de 25 pb, bien que possible et sans risque immédiat, n’aurait qu’un effet marginal sur la consommation et l’investissement privé. La politique monétaire se situe donc à un niveau approprié, conservant un caractère accommodant tout en laissant à la politique budgétaire et à l’investissement le rôle moteur de la conjoncture. Si vous voulez que l'information se rapproche de vous Suivez la chaîne Médias24 sur WhatsApp © Médias24. Toute reproduction interdite, sous quelque forme que ce soit, sauf autorisation écrite de la Société des Nouveaux Médias. Ce contenu est protégé par la loi et notamment loi 88-13 relative à la presse et l’édition ainsi que les lois 66.19 et 2-00 relatives aux droits d’auteur et droits voisins.",https://medias24.com/2025/09/21/taux-directeur-le-statu-quo-reste-le-scenario-le-plus-probable/,2025-09-21 00:00:00.000000,Medias24,a34f268b76bb1a1ba3a9e4ff4554b6db,2025-09-21 21:32:28,corporate finance; asset management
"Viandes rouges : une flambée persistante, retard des aides","Les prix des viandes rouges, notamment de la viande ovine, restent élevés. Contactés par Médias24, des professionnels du secteur pointent, entre autres problèmes, le retard des subventions annoncées par le gouvernement, en particulier pour les aliments du bétail. Les prix des viandes rouges avoisinent toujours les 100 DH/kg ou plus dans différentes régions du Maroc. Au marché de gros de Casablanca, le mercredi 10 septembre, la viande ovine oscillait de 85 à 110 DH/kg, tandis que la viande bovine coûtait de 74 à 94 DH/kg. Chez les bouchers, des marges supplémentaires pouvant atteindre 40 DH/kg sont appliquées, accentuant encore le coût pour le consommateur. Ces niveaux de prix perdurent depuis plus d’un an, malgré les multiples mesures mises en place par le ministère de l’Agriculture. Une situation dénoncée par les consommateurs, d’autant que le dernier recensement du cheptel national a montré que l’offre est suffisante pour répondre aux besoins du pays, particulièrement pour la viande ovine. (Publicité) (Publicité) Des marges très élevées et une désorganisation du marché Joints par Médias24, différents professionnels du secteur pointent toujours les mêmes problématiques, à savoir les spéculations et la désorganisation du marché, mais ajoutent cette fois-ci ""le retard de la mise en œuvre des mesures annoncées dans le cadre du programme de reconstitution du cheptel"". D’après l’une de nos sources, ""pour un veau vif, le kilogramme se négocie actuellement autour de 95 DH, tandis qu’un agneau de lait vif atteint jusqu'à 120 DH. Un mouton destiné à l’abattage, d’un poids variant entre 45 kg et 50 kg, coûte pour sa part 95 DH/kg, soit 30 DH de plus qu’il y a quelques mois"". ""Si l’on fait le calcul, un agneau de lait pourrait coûter jusqu’à 1 .700 DH actuellement. Son prix continue d’augmenter, car il est très prisé pour Aïd al-Adha et pourrait atteindre jusqu'à 2.500 DH"". ""Les engraisseurs commencent déjà à acheter leurs moutons en prévision de l’Aïd"", nous confie notre source, estimant qu’il est peu probable qu’un nouvel appel à l’abstention du sacrifice soit lancé une deuxième année consécutive. ""Pour le prochain Aïd, les prix pourraient atteindre des niveaux record. Un agneau de lait peut consommer jusqu’à 3.000 DH d’alimentation d’ici cette période, une charge qui doit être compensée lors de sa vente"", avertit notre source. ""Un engraisseur qui l'achète actuellement à 1.700 DH pourrait donc le vendre à plus de 4.000 DH durant l'Aïd"". Même constat auprès d’un autre professionnel. ""Le lendemain du recensement, le prix du kilogramme d’agneau vif avoisinait 60 DH à 65 DH, alors que chez les bouchers, il dépassait largement les 100 DH/kg"", souligne-t-il, pointant les marges appliquées par ces derniers. Selon notre première source, le problème vient avant tout du circuit commercial. ""Le bétail est vendu jusqu’à six reprises avant d’arriver au marché de gros. Le marché est désorganisé et soumis à la spéculation"". D'autre part, ""les marchés de gros souffrent d’un manque d’organisation, notamment de l'absence de certificats de naissance, de décès ou d’abattage, ainsi que le manque de traçabilité… Autant d’éléments qui alimentent la spéculation. Il faut donc s’attaquer au cœur du problème"", dénonce l'une de nos sources. Flambée des prix des aliments Outre cette problématique structurelle, les professionnels pointent le coût des aliments pour bétail. ""L’orge, le tourteau de soja ou encore le maïs ont vu leurs prix s’envoler. L’orge est vendue à 2,80 DH/kg et le tourteau de tournesol entre 2,20 et 2,25 DH/kg. Le blé tendre local coûte 2,20 DH/kg, contre 3,15 DH/kg pour l’importé, subventionné à hauteur de 1 DH par l’État. Au final, l’aliment d’engraissement peut atteindre 3,5 DH/kg"". ""On nous parle de subventions, mais elles tardent à entrer en vigueur. Tout est importé et le coût reste prohibitif pour la majorité des éleveurs, surtout les petits qui représentent 95% du secteur"", nous explique-t-on. ""Le prix de l’orge, indispensable pour l’alimentation du cheptel, a bondi de 50% pour atteindre 3 DH le kilogramme"", nous confirme une autre source du secteur, ""alors que le soutien prévu par l’État devrait le ramener à 1,50 DH/kg"". En effet, dans le cadre du programme de reconstitution du cheptel, le ministère de l’Agriculture avait annoncé, le 18 juin dernier, la subvention de l’aliment de bétail. L’État prévoit de subventionner l’orge à 1,5 DH/kg (dans la limite de 7 millions de quintaux) et les aliments composés à 2 DH/kg. L’acquisition devait se faire via des appels d’offres lancés par l’Office national interprofessionnel des céréales et des légumineuses (ONICL), avec un suivi renforcé de la distribution sur le terrain. D’après nos sources, aucune de ces mesures n’a encore été réellement mise en œuvre, ""ce qui incitera, à terme, certains éleveurs à envisager d’abandonner leur activité"". Attentes des éleveurs et impact de la sécheresse Les éleveurs insistent également sur l’urgence de l'appui financier pour les femelles reproductrices. Toujours dans le cadre du plan de reconstitution du cheptel, le ministère avait prévu une subvention de 400 DH par brebis ou chèvre femelle conservée dans le cheptel pendant une durée déterminée, mais il n'en est toujours rien selon les éleveurs sondés. ""La période actuelle correspond au début des agnelages et à la préparation des brebis à la gestation, qui dure en moyenne un à un mois et demi. Sans une alimentation adéquate avant cette phase, la production pourrait en pâtir. C’est donc le moment opportun pour mettre en œuvre les mesures annoncées, notamment l’aide financière de 400 DH pour chaque femelle identifiée et non abattue"", concluent nos sources. Contacté par Médias24, le ministère de l'Agriculture n'avait pas encore donné suite à notre requête au moment de la publication du présent article. À suivre... Si vous voulez que l'information se rapproche de vous Suivez la chaîne Médias24 sur WhatsApp © Médias24. Toute reproduction interdite, sous quelque forme que ce soit, sauf autorisation écrite de la Société des Nouveaux Médias. Ce contenu est protégé par la loi et notamment loi 88-13 relative à la presse et l’édition ainsi que les lois 66.19 et 2-00 relatives aux droits d’auteur et droits voisins.",https://medias24.com/2025/09/15/viandes-rouges-les-prix-restent-eleves-malgre-un-cheptel-suffisant-et-les-mesures-annoncees/,2025-09-15 00:00:00.000000,Medias24,65dbbc2d471400cd9c69e9a13fec3071,2025-09-21 21:32:33,corporate finance
